No.,Time,Source,Destination,Protocol,Length,Info,TTL,Flags,DSCP,LEN
1,0,192.168.1.94,142.250.75.110,TCP,74,60366  >  443 [SYN] Seq=0 Win=64240 Len=0 MSS=1460 SACK_PERM TSval=1158780113 TSecr=0 WS=128,64,0x2,0x00,60
2,0.011204337,142.250.75.110,192.168.1.94,TCP,74,"443  >  60366 [SYN, ACK] Seq=0 Ack=1 Win=65535 Len=0 MSS=1412 SACK_PERM TSval=2478391774 TSecr=1158780113 WS=256",121,0x2,0x00,60
3,0.013089107,192.168.1.94,142.250.75.110,TCP,66,60366  >  443 [ACK] Seq=1 Ack=1 Win=64256 Len=0 TSval=1158780124 TSecr=2478391774,64,0x2,0x00,52
4,0.01904069,192.168.1.94,142.250.75.110,TLSv1.3,583,Client Hello (SNI=www.youtube.com),64,0x2,0x00,569
5,0.028036402,142.250.75.110,192.168.1.94,TCP,66,443  >  60366 [ACK] Seq=1 Ack=518 Win=268288 Len=0 TSval=2478391792 TSecr=1158780132,121,0x0,0x00,52
6,0.087055211,142.250.75.110,192.168.1.94,TLSv1.3,2866,"Server Hello, Change Cipher Spec",121,0x0,0x00,2852
7,0.087055821,142.250.75.110,192.168.1.94,TLSv1.3,2866,Continuation Data,121,0x0,0x00,2852
8,0.087055841,142.250.75.110,192.168.1.94,TLSv1.3,1050,Continuation Data,121,0x0,0x00,1036
9,0.087155178,192.168.1.94,142.250.75.110,TCP,66,60366  >  443 [ACK] Seq=518 Ack=2801 Win=69760 Len=0 TSval=1158780200 TSecr=2478391844,64,0x2,0x00,52
10,0.08734108,192.168.1.94,142.250.75.110,TCP,66,60366  >  443 [ACK] Seq=518 Ack=6585 Win=78208 Len=0 TSval=1158780200 TSecr=2478391844,64,0x2,0x00,52
11,0.515799985,192.168.1.94,142.250.75.110,TLSv1.3,130,"Change Cipher Spec, Application Data",64,0x2,0x00,116
12,0.517408806,192.168.1.94,142.250.75.110,TLSv1.3,236,Application Data,64,0x2,0x00,222
13,0.517697425,192.168.1.94,142.250.75.110,TLSv1.3,1807,Application Data,64,0x2,0x00,1793
14,0.531030866,142.250.75.110,192.168.1.94,TCP,66,443  >  60366 [ACK] Seq=6585 Ack=582 Win=268800 Len=0 TSval=2478392290 TSecr=1158780628,121,0x0,0x00,52
15,0.53103121,142.250.75.110,192.168.1.94,TCP,66,443  >  60366 [ACK] Seq=6585 Ack=752 Win=268800 Len=0 TSval=2478392290 TSecr=1158780630,121,0x0,0x00,52
16,0.53103123,142.250.75.110,192.168.1.94,TLSv1.3,680,"Application Data, Application Data",121,0x0,0x00,666
17,0.53103125,142.250.75.110,192.168.1.94,TLSv1.3,97,Application Data,121,0x0,0x00,83
18,0.531031272,142.250.75.110,192.168.1.94,TCP,78,[TCP Dup ACK 15#1] 443  >  60366 [ACK] Seq=7230 Ack=752 Win=268800 Len=0 TSval=2478392293 TSecr=1158780630 SLE=2152 SRE=2493,121,0x0,0x00,64
19,0.531031323,142.250.75.110,192.168.1.94,TCP,66,443  >  60366 [ACK] Seq=7230 Ack=2493 Win=267264 Len=0 TSval=2478392293 TSecr=1158780630,121,0x0,0x00,52
20,0.531066954,192.168.1.94,142.250.75.110,TCP,66,60366  >  443 [ACK] Seq=2493 Ack=7199 Win=80896 Len=0 TSval=1158780644 TSecr=2478392290,64,0x2,0x00,52
21,0.532455075,192.168.1.94,142.250.75.110,TCP,66,60366  >  443 [ACK] Seq=2493 Ack=7230 Win=80896 Len=0 TSval=1158780645 TSecr=2478392291,64,0x2,0x00,52
22,0.535459313,192.168.1.94,142.250.75.110,TLSv1.3,97,Application Data,64,0x2,0x00,83
23,0.547460588,142.250.75.110,192.168.1.94,TCP,66,443  >  60366 [ACK] Seq=7230 Ack=2524 Win=267264 Len=0 TSval=2478392313 TSecr=1158780648,121,0x0,0x00,52
24,0.674563197,142.250.75.110,192.168.1.94,TLSv1.3,1466,Application Data,121,0x0,0x00,1452
25,0.674563514,142.250.75.110,192.168.1.94,TLSv1.3,352,Application Data,121,0x0,0x00,338
26,0.674563541,142.250.75.110,192.168.1.94,TLSv1.3,1466,Application Data,121,0x0,0x00,1452
27,0.674563562,142.250.75.110,192.168.1.94,TLSv1.3,2431,"Application Data, Application Data",121,0x0,0x00,2417
28,0.67459654,192.168.1.94,142.250.75.110,TCP,66,60366  >  443 [ACK] Seq=2524 Ack=8916 Win=86528 Len=0 TSval=1158780787 TSecr=2478392437,64,0x2,0x00,52
29,0.684520162,142.250.75.110,192.168.1.94,TLSv1.3,1466,Application Data,121,0x0,0x00,1452
30,0.684520461,142.250.75.110,192.168.1.94,TLSv1.3,1466,Application Data,121,0x0,0x00,1452
31,0.684520482,142.250.75.110,192.168.1.94,TLSv1.3,1466,Application Data,121,0x0,0x00,1452
32,0.694876394,192.168.1.94,142.250.75.110,TCP,66,60366  >  443 [ACK] Seq=2524 Ack=12681 Win=82816 Len=0 TSval=1158780807 TSecr=2478392437,64,0x2,0x00,52
33,0.695140215,142.250.75.110,192.168.1.94,TLSv1.3,1466,Application Data,121,0x0,0x00,1452
34,0.695140403,142.250.75.110,192.168.1.94,TLSv1.3,2866,"Application Data, Application Data",121,0x0,0x00,2852
35,0.695140424,142.250.75.110,192.168.1.94,TLSv1.3,308,Application Data,121,0x0,0x00,294
36,0.695140443,142.250.75.110,192.168.1.94,TLSv1.3,1466,Application Data,121,0x0,0x00,1452
37,0.695140465,142.250.75.110,192.168.1.94,TLSv1.3,1466,Application Data,121,0x0,0x00,1452
38,0.695140485,142.250.75.110,192.168.1.94,TLSv1.3,2866,"Application Data, Application Data",121,0x0,0x00,2852
39,0.695174616,142.250.75.110,192.168.1.94,TLSv1.3,2866,"Application Data, Application Data",121,0x0,0x00,2852
40,0.695174647,142.250.75.110,192.168.1.94,TLSv1.3,2866,Continuation Data,121,0x0,0x00,2852
41,0.695174667,142.250.75.110,192.168.1.94,TLSv1.3,2866,Continuation Data,121,0x0,0x00,2852
42,0.695174687,142.250.75.110,192.168.1.94,TLSv1.3,746,Continuation Data,121,0x0,0x00,732
43,0.695174707,142.250.75.110,192.168.1.94,TLSv1.3,110,Application Data,121,0x0,0x00,96
44,0.695251445,142.250.75.110,192.168.1.94,TLSv1.3,261,Application Data,121,0x0,0x00,247
45,0.695251498,142.250.75.110,192.168.1.94,TLSv1.3,116,Application Data,121,0x0,0x00,102
46,0.700062328,192.168.1.94,142.250.75.110,TCP,66,60366  >  443 [ACK] Seq=2524 Ack=36292 Win=59264 Len=0 TSval=1158780813 TSecr=2478392447,64,0x2,0x00,52
47,0.704890923,142.250.75.110,192.168.1.94,TLSv1.3,2866,"Application Data, Application Data",121,0x0,0x00,2852
48,0.704891288,142.250.75.110,192.168.1.94,TLSv1.3,2866,"Application Data, Application Data",121,0x0,0x00,2852
49,0.704920562,192.168.1.94,142.250.75.110,TCP,66,60366  >  443 [ACK] Seq=2524 Ack=39092 Win=86912 Len=0 TSval=1158780818 TSecr=2478392468,64,0x2,0x00,52
50,0.705124427,192.168.1.94,142.250.75.110,TCP,66,60366  >  443 [ACK] Seq=2524 Ack=41892 Win=84224 Len=0 TSval=1158780818 TSecr=2478392468,64,0x2,0x00,52
51,0.707598106,142.250.75.110,192.168.1.94,TLSv1.3,2866,Continuation Data,121,0x0,0x00,2852
52,0.707616909,192.168.1.94,142.250.75.110,TCP,66,60366  >  443 [ACK] Seq=2524 Ack=44692 Win=86912 Len=0 TSval=1158780820 TSecr=2478392469,64,0x2,0x00,52
53,0.707994724,142.250.75.110,192.168.1.94,TLSv1.3,2537,Continuation Data,121,0x0,0x00,2523
54,0.708296796,192.168.1.94,142.250.75.110,TCP,66,60366  >  443 [ACK] Seq=2524 Ack=47163 Win=84480 Len=0 TSval=1158780821 TSecr=2478392474,64,0x2,0x00,52
55,1.689166977,142.250.75.110,192.168.1.94,TLSv1.3,142,Application Data,121,0x0,0x00,128
56,1.724967421,142.250.75.110,192.168.1.94,TLSv1.3,1466,Application Data,121,0x0,0x00,1452
57,1.725245416,192.168.1.94,142.250.75.110,TCP,66,60366  >  443 [ACK] Seq=2524 Ack=48639 Win=89600 Len=0 TSval=1158781838 TSecr=2478393444,64,0x2,0x00,52
58,1.728837445,142.250.75.110,192.168.1.94,TLSv1.3,1466,Application Data,121,0x0,0x00,1452
59,1.728837763,142.250.75.110,192.168.1.94,TLSv1.3,2866,"Application Data, Application Data",121,0x0,0x00,2852
60,1.728837792,142.250.75.110,192.168.1.94,TLSv1.3,2004,"Application Data, Application Data",121,0x0,0x00,1990
61,1.728837812,142.250.75.110,192.168.1.94,TLSv1.3,1466,Application Data,121,0x0,0x00,1452
62,1.728911197,192.168.1.94,142.250.75.110,TCP,66,60366  >  443 [ACK] Seq=2524 Ack=52839 Win=98048 Len=0 TSval=1158781842 TSecr=2478393490,64,0x2,0x00,52
63,1.729000412,192.168.1.94,142.250.75.110,TCP,66,60366  >  443 [ACK] Seq=2524 Ack=54777 Win=101888 Len=0 TSval=1158781842 TSecr=2478393491,64,0x2,0x00,52
64,1.736658335,142.250.75.110,192.168.1.94,TLSv1.3,1381,Application Data,121,0x0,0x00,1367
65,1.736658605,142.250.75.110,192.168.1.94,TLSv1.3,1466,Application Data,121,0x0,0x00,1452
66,1.736658625,142.250.75.110,192.168.1.94,TLSv1.3,862,Application Data,121,0x0,0x00,848
67,1.736658693,142.250.75.110,192.168.1.94,TLSv1.3,1466,Application Data,121,0x0,0x00,1452
68,1.736658713,142.250.75.110,192.168.1.94,TLSv1.3,1466,Application Data,121,0x0,0x00,1452
69,1.736658734,142.250.75.110,192.168.1.94,TLSv1.3,253,Application Data,121,0x0,0x00,239
70,1.736658753,142.250.75.110,192.168.1.94,TLSv1.3,857,Application Data,121,0x0,0x00,843
71,1.736682634,192.168.1.94,142.250.75.110,TCP,66,60366  >  443 [ACK] Seq=2524 Ack=57492 Win=107520 Len=0 TSval=1158781849 TSecr=2478393492,64,0x2,0x00,52
72,1.736782411,192.168.1.94,142.250.75.110,TCP,66,60366  >  443 [ACK] Seq=2524 Ack=59688 Win=113152 Len=0 TSval=1158781849 TSecr=2478393492,64,0x2,0x00,52
73,1.736829112,192.168.1.94,142.250.75.110,TCP,66,60366  >  443 [ACK] Seq=2524 Ack=62488 Win=118784 Len=0 TSval=1158781849 TSecr=2478393495,64,0x2,0x00,52
74,1.739200023,142.250.75.110,192.168.1.94,TLSv1.3,1466,Application Data,121,0x0,0x00,1452
75,1.739200121,142.250.75.110,192.168.1.94,TLSv1.3,764,Application Data,121,0x0,0x00,750
76,1.739200142,142.250.75.110,192.168.1.94,TLSv1.3,1466,Application Data,121,0x0,0x00,1452
77,1.739214416,192.168.1.94,142.250.75.110,TCP,66,60366  >  443 [ACK] Seq=2524 Ack=64866 Win=127104 Len=0 TSval=1158781852 TSecr=2478393495,64,0x2,0x00,52
78,1.739281598,192.168.1.94,142.250.75.110,TCP,66,60366  >  443 [ACK] Seq=2524 Ack=66964 Win=132736 Len=0 TSval=1158781852 TSecr=2478393499,64,0x2,0x00,52
79,1.740822109,142.250.75.110,192.168.1.94,TLSv1.3,461,Application Data,121,0x0,0x00,447
80,1.740822192,142.250.75.110,192.168.1.94,TLSv1.3,1466,Application Data,121,0x0,0x00,1452
81,1.740822273,142.250.75.110,192.168.1.94,TLSv1.3,917,Application Data,121,0x0,0x00,903
82,1.740838517,192.168.1.94,142.250.75.110,TCP,66,60366  >  443 [ACK] Seq=2524 Ack=68759 Win=138368 Len=0 TSval=1158781853 TSecr=2478393499,64,0x2,0x00,52
83,1.743013673,142.250.75.110,192.168.1.94,TLSv1.3,1207,Application Data,121,0x0,0x00,1193
84,1.743026674,192.168.1.94,142.250.75.110,TCP,66,60366  >  443 [ACK] Seq=2524 Ack=70751 Win=144000 Len=0 TSval=1158781856 TSecr=2478393500,64,0x2,0x00,52
85,1.746068005,142.250.75.110,192.168.1.94,TLSv1.3,1466,Application Data,121,0x0,0x00,1452
86,1.746068246,142.250.75.110,192.168.1.94,TLSv1.3,1452,Application Data,121,0x0,0x00,1438
87,1.746068265,142.250.75.110,192.168.1.94,TLSv1.3,1466,Application Data,121,0x0,0x00,1452
88,1.746068285,142.250.75.110,192.168.1.94,TLSv1.3,1499,"Application Data, Application Data",121,0x0,0x00,1485
89,1.746068304,142.250.75.110,192.168.1.94,TLSv1.3,1466,Application Data,121,0x0,0x00,1452
90,1.746068325,142.250.75.110,192.168.1.94,TLSv1.3,1466,Application Data,121,0x0,0x00,1452
91,1.746068346,142.250.75.110,192.168.1.94,TLSv1.3,1386,"Application Data, Application Data",121,0x0,0x00,1372
92,1.746093921,192.168.1.94,142.250.75.110,TCP,66,60366  >  443 [ACK] Seq=2524 Ack=73537 Win=149504 Len=0 TSval=1158781859 TSecr=2478393505,64,0x2,0x00,52
93,1.74618147,192.168.1.94,142.250.75.110,TCP,66,60366  >  443 [ACK] Seq=2524 Ack=76370 Win=155264 Len=0 TSval=1158781859 TSecr=2478393506,64,0x2,0x00,52
94,1.746229461,192.168.1.94,142.250.75.110,TCP,66,60366  >  443 [ACK] Seq=2524 Ack=79170 Win=160768 Len=0 TSval=1158781859 TSecr=2478393507,64,0x2,0x00,52
95,1.746303557,142.250.75.110,192.168.1.94,TLSv1.3,1466,Application Data,121,0x0,0x00,1452
96,1.746303619,142.250.75.110,192.168.1.94,TLSv1.3,1466,Application Data,121,0x0,0x00,1452
97,1.746303639,142.250.75.110,192.168.1.94,TLSv1.3,134,Application Data,121,0x0,0x00,120
98,1.746303668,142.250.75.110,192.168.1.94,TLSv1.3,1466,Application Data,121,0x0,0x00,1452
99,1.746303695,142.250.75.110,192.168.1.94,TLSv1.3,255,Application Data,121,0x0,0x00,241
100,1.746309188,192.168.1.94,142.250.75.110,TCP,66,60366  >  443 [ACK] Seq=2524 Ack=81890 Win=166400 Len=0 TSval=1158781859 TSecr=2478393507,64,0x2,0x00,52
101,1.746356463,192.168.1.94,142.250.75.110,TCP,66,60366  >  443 [ACK] Seq=2524 Ack=83358 Win=169216 Len=0 TSval=1158781859 TSecr=2478393508,64,0x2,0x00,52
102,1.746415748,192.168.1.94,142.250.75.110,TCP,66,60366  >  443 [ACK] Seq=2524 Ack=84947 Win=174848 Len=0 TSval=1158781859 TSecr=2478393508,64,0x2,0x00,52
103,1.749935664,142.250.75.110,192.168.1.94,TLSv1.3,1466,Application Data,121,0x0,0x00,1452
104,1.749936232,142.250.75.110,192.168.1.94,TLSv1.3,1466,Application Data,121,0x0,0x00,1452
105,1.74993626,142.250.75.110,192.168.1.94,TLSv1.3,968,Application Data,121,0x0,0x00,954
106,1.749958763,192.168.1.94,142.250.75.110,TCP,66,60366  >  443 [ACK] Seq=2524 Ack=87747 Win=180352 Len=0 TSval=1158781863 TSecr=2478393511,64,0x2,0x00,52
107,1.754345086,142.250.75.110,192.168.1.94,TLSv1.3,505,Application Data,121,0x0,0x00,491
108,1.754345756,142.250.75.110,192.168.1.94,TLSv1.3,1466,Application Data,121,0x0,0x00,1452
109,1.754345785,142.250.75.110,192.168.1.94,TLSv1.3,972,Application Data,121,0x0,0x00,958
110,1.754345805,142.250.75.110,192.168.1.94,TLSv1.3,1466,Application Data,121,0x0,0x00,1452
111,1.754345869,142.250.75.110,192.168.1.94,TLSv1.3,492,Application Data,121,0x0,0x00,478
112,1.754345889,142.250.75.110,192.168.1.94,TLSv1.3,1466,Application Data,121,0x0,0x00,1452
113,1.754372083,192.168.1.94,142.250.75.110,TCP,66,60366  >  443 [ACK] Seq=2524 Ack=90488 Win=188800 Len=0 TSval=1158781867 TSecr=2478393512,64,0x2,0x00,52
114,1.754471148,192.168.1.94,142.250.75.110,TCP,66,60366  >  443 [ACK] Seq=2524 Ack=92794 Win=194432 Len=0 TSval=1158781867 TSecr=2478393514,64,0x2,0x00,52
115,1.754516883,192.168.1.94,142.250.75.110,TCP,66,60366  >  443 [ACK] Seq=2524 Ack=94620 Win=200064 Len=0 TSval=1158781867 TSecr=2478393515,64,0x2,0x00,52
116,1.757116211,142.250.75.110,192.168.1.94,TLSv1.3,1273,Application Data,121,0x0,0x00,1259
117,1.757116368,142.250.75.110,192.168.1.94,TLSv1.3,1085,Application Data,121,0x0,0x00,1071
118,1.757133148,192.168.1.94,142.250.75.110,TCP,66,60366  >  443 [ACK] Seq=2524 Ack=96846 Win=205568 Len=0 TSval=1158781870 TSecr=2478393516,64,0x2,0x00,52
119,1.759405577,142.250.75.110,192.168.1.94,TLSv1.3,1466,Application Data,121,0x0,0x00,1452
120,1.759405841,142.250.75.110,192.168.1.94,TLSv1.3,1466,Application Data,121,0x0,0x00,1452
121,1.75940598,142.250.75.110,192.168.1.94,TLSv1.3,143,Application Data,121,0x0,0x00,129
122,1.759569143,192.168.1.94,142.250.75.110,TCP,66,60366  >  443 [ACK] Seq=2524 Ack=99646 Win=211200 Len=0 TSval=1158781872 TSecr=2478393519,64,0x2,0x00,52
123,1.76281801,142.250.75.110,192.168.1.94,TLSv1.3,1293,Application Data,121,0x0,0x00,1279
124,1.762818251,142.250.75.110,192.168.1.94,TLSv1.3,1466,Application Data,121,0x0,0x00,1452
125,1.762818272,142.250.75.110,192.168.1.94,TLSv1.3,1466,Application Data,121,0x0,0x00,1452
126,1.762818292,142.250.75.110,192.168.1.94,TLSv1.3,183,Application Data,121,0x0,0x00,169
127,1.762818313,142.250.75.110,192.168.1.94,TLSv1.3,1006,Application Data,121,0x0,0x00,992
128,1.762818334,142.250.75.110,192.168.1.94,TLSv1.3,1466,Application Data,121,0x0,0x00,1452
129,1.762818354,142.250.75.110,192.168.1.94,TLSv1.3,1378,Application Data,121,0x0,0x00,1364
130,1.762818375,142.250.75.110,192.168.1.94,TLSv1.3,220,Application Data,121,0x0,0x00,206
131,1.763063652,192.168.1.94,142.250.75.110,TCP,66,60366  >  443 [ACK] Seq=2524 Ack=102350 Win=216832 Len=0 TSval=1158781876 TSecr=2478393519,64,0x2,0x00,52
132,1.763205887,192.168.1.94,142.250.75.110,TCP,66,60366  >  443 [ACK] Seq=2524 Ack=107673 Win=231040 Len=0 TSval=1158781876 TSecr=2478393522,64,0x2,0x00,52
133,1.783455182,142.250.75.110,192.168.1.94,TLSv1.3,1466,Application Data,121,0x0,0x00,1452
134,1.783455212,142.250.75.110,192.168.1.94,TLSv1.3,254,Application Data,121,0x0,0x00,240
135,1.783455233,142.250.75.110,192.168.1.94,TLSv1.3,1466,Application Data,121,0x0,0x00,1452
136,1.783455254,142.250.75.110,192.168.1.94,TLSv1.3,1466,Application Data,121,0x0,0x00,1452
137,1.783455274,142.250.75.110,192.168.1.94,TLSv1.3,1466,Application Data,121,0x0,0x00,1452
138,1.783455294,142.250.75.110,192.168.1.94,TLSv1.3,2866,"Application Data, Application Data",121,0x0,0x00,2852
139,1.785927118,192.168.1.94,142.250.75.110,TCP,66,60366  >  443 [ACK] Seq=2524 Ack=109261 Win=236672 Len=0 TSval=1158781899 TSecr=2478393543,64,0x2,0x00,52
140,1.78629995,192.168.1.94,142.250.75.110,TCP,66,60366  >  443 [ACK] Seq=2524 Ack=112061 Win=242176 Len=0 TSval=1158781899 TSecr=2478393548,64,0x2,0x00,52
141,1.788618797,192.168.1.94,142.250.75.110,TCP,66,60366  >  443 [ACK] Seq=2524 Ack=116261 Win=250624 Len=0 TSval=1158781901 TSecr=2478393549,64,0x2,0x00,52
142,1.788837145,142.250.75.110,192.168.1.94,TLSv1.3,4266,"Application Data, Application Data, Application Data",121,0x0,0x00,4252
143,1.788850835,192.168.1.94,142.250.75.110,TCP,66,60366  >  443 [ACK] Seq=2524 Ack=120461 Win=259072 Len=0 TSval=1158781901 TSecr=2478393549,64,0x2,0x00,52
144,1.790012076,142.250.75.110,192.168.1.94,TLSv1.3,5666,"Application Data, Application Data, Application Data, Application Data",121,0x0,0x00,5652
145,1.790064894,192.168.1.94,142.250.75.110,TCP,66,60366  >  443 [ACK] Seq=2524 Ack=126061 Win=270208 Len=0 TSval=1158781903 TSecr=2478393550,64,0x2,0x00,52
146,1.792302151,142.250.75.110,192.168.1.94,TLSv1.3,5666,"Application Data, Application Data, Application Data, Application Data",121,0x0,0x00,5652
147,1.792324969,192.168.1.94,142.250.75.110,TCP,66,60366  >  443 [ACK] Seq=2524 Ack=131661 Win=281472 Len=0 TSval=1158781905 TSecr=2478393551,64,0x2,0x00,52
148,1.794024713,142.250.75.110,192.168.1.94,TLSv1.3,5666,"Application Data, Application Data, Application Data, Application Data",121,0x0,0x00,5652
149,1.794076943,192.168.1.94,142.250.75.110,TCP,66,60366  >  443 [ACK] Seq=2524 Ack=137261 Win=292608 Len=0 TSval=1158781907 TSecr=2478393552,64,0x2,0x00,52
150,1.798268557,142.250.75.110,192.168.1.94,TLSv1.3,5666,"Application Data, Application Data, Application Data, Application Data",121,0x0,0x00,5652
151,1.79826882,142.250.75.110,192.168.1.94,TLSv1.3,5666,Continuation Data,121,0x0,0x00,5652
152,1.798333334,192.168.1.94,142.250.75.110,TCP,66,60366  >  443 [ACK] Seq=2524 Ack=142861 Win=303872 Len=0 TSval=1158781911 TSecr=2478393553,64,0x2,0x00,52
153,1.798411895,192.168.1.94,142.250.75.110,TCP,66,60366  >  443 [ACK] Seq=2524 Ack=148461 Win=315008 Len=0 TSval=1158781911 TSecr=2478393554,64,0x2,0x00,52
154,1.798489896,142.250.75.110,192.168.1.94,TLSv1.3,1783,Continuation Data,121,0x0,0x00,1769
155,1.798495147,192.168.1.94,142.250.75.110,TCP,66,60366  >  443 [ACK] Seq=2524 Ack=150178 Win=318464 Len=0 TSval=1158781911 TSecr=2478393555,64,0x2,0x00,52
156,1.798699999,192.168.1.94,142.250.75.110,TLSv1.3,105,Application Data,64,0x2,0x00,91
157,1.799636525,192.168.1.94,142.250.75.110,TLSv1.3,434,Application Data,64,0x2,0x00,420
158,1.801867482,192.168.1.94,142.250.75.110,TLSv1.3,246,Application Data,64,0x2,0x00,232
159,1.803621563,192.168.1.94,142.250.75.110,TLSv1.3,101,Application Data,64,0x2,0x00,87
160,1.813382031,142.250.75.110,192.168.1.94,TCP,66,443  >  60366 [ACK] Seq=150178 Ack=2563 Win=267264 Len=0 TSval=2478393572 TSecr=1158781911,121,0x0,0x00,52
161,1.813382375,142.250.75.110,192.168.1.94,TCP,66,443  >  60366 [ACK] Seq=150178 Ack=2931 Win=267008 Len=0 TSval=2478393572 TSecr=1158781912,121,0x0,0x00,52
162,1.813382398,142.250.75.110,192.168.1.94,TCP,66,443  >  60366 [ACK] Seq=150178 Ack=3111 Win=267008 Len=0 TSval=2478393576 TSecr=1158781914,121,0x0,0x00,52
163,1.813382417,142.250.75.110,192.168.1.94,TCP,66,443  >  60366 [ACK] Seq=150178 Ack=3146 Win=267008 Len=0 TSval=2478393576 TSecr=1158781916,121,0x0,0x00,52
164,1.889576938,142.250.75.110,192.168.1.94,TLSv1.3,673,Application Data,121,0x0,0x00,659
165,1.889577281,142.250.75.110,192.168.1.94,TLSv1.3,1466,Application Data,121,0x0,0x00,1452
166,1.889577308,142.250.75.110,192.168.1.94,TLSv1.3,1466,Application Data,121,0x0,0x00,1452
167,1.889577329,142.250.75.110,192.168.1.94,TLSv1.3,679,Application Data,121,0x0,0x00,665
168,1.889781738,192.168.1.94,142.250.75.110,TCP,66,60366  >  443 [ACK] Seq=3146 Ack=152185 Win=324096 Len=0 TSval=1158782002 TSecr=2478393656,64,0x2,0x00,52
169,1.889897707,192.168.1.94,142.250.75.110,TCP,66,60366  >  443 [ACK] Seq=3146 Ack=154198 Win=328064 Len=0 TSval=1158782003 TSecr=2478393656,64,0x2,0x00,52
170,1.892219584,142.250.75.110,192.168.1.94,TLSv1.3,98,Application Data,121,0x0,0x00,84
171,1.892220014,142.250.75.110,192.168.1.94,TLSv1.3,97,Application Data,121,0x0,0x00,83
172,1.892220052,142.250.75.110,192.168.1.94,TLSv1.3,105,Application Data,121,0x0,0x00,91
173,1.892460489,192.168.1.94,142.250.75.110,TCP,66,60366  >  443 [ACK] Seq=3146 Ack=154300 Win=328064 Len=0 TSval=1158782005 TSecr=2478393656,64,0x2,0x00,52
174,1.892688928,192.168.1.94,142.250.75.110,TLSv1.3,105,Application Data,64,0x2,0x00,91
175,1.900742794,142.250.75.110,192.168.1.94,TCP,66,443  >  60366 [ACK] Seq=154300 Ack=3185 Win=267008 Len=0 TSval=2478393668 TSecr=1158782005,121,0x0,0x00,52
176,3.152809827,192.168.1.94,142.250.75.110,TLSv1.3,524,Application Data,64,0x2,0x00,510
177,3.155535155,192.168.1.94,142.250.75.110,TLSv1.3,1166,Application Data,64,0x2,0x00,1152
178,3.160527404,142.250.75.110,192.168.1.94,TCP,66,443  >  60366 [ACK] Seq=154300 Ack=3643 Win=266752 Len=0 TSval=2478394926 TSecr=1158783265,121,0x0,0x00,52
179,3.161323161,192.168.1.94,142.250.75.110,TLSv1.3,182,Application Data,64,0x2,0x00,168
180,3.161519437,192.168.1.94,142.250.75.110,TLSv1.3,184,Application Data,64,0x2,0x00,170
181,3.165067866,142.250.75.110,192.168.1.94,TCP,66,443  >  60366 [ACK] Seq=154300 Ack=4743 Win=265728 Len=0 TSval=2478394930 TSecr=1158783268,121,0x0,0x00,52
182,3.170140189,142.250.75.110,192.168.1.94,TCP,66,443  >  60366 [ACK] Seq=154300 Ack=4859 Win=265728 Len=0 TSval=2478394936 TSecr=1158783274,121,0x0,0x00,52
183,3.172599185,142.250.75.110,192.168.1.94,TCP,66,443  >  60366 [ACK] Seq=154300 Ack=4977 Win=265728 Len=0 TSval=2478394938 TSecr=1158783274,121,0x0,0x00,52
184,3.266465093,142.250.75.110,192.168.1.94,TLSv1.3,431,Application Data,121,0x0,0x00,417
185,3.266465325,142.250.75.110,192.168.1.94,TLSv1.3,1466,Application Data,121,0x0,0x00,1452
186,3.266629484,192.168.1.94,142.250.75.110,TCP,66,60366  >  443 [ACK] Seq=4977 Ack=156065 Win=333696 Len=0 TSval=1158783379 TSecr=2478395031,64,0x2,0x00,52
187,3.267291805,142.250.75.110,192.168.1.94,TLSv1.3,1466,Application Data,121,0x0,0x00,1452
188,3.267291976,142.250.75.110,192.168.1.94,TLSv1.3,2866,"Application Data, Application Data",121,0x0,0x00,2852
189,3.267291997,142.250.75.110,192.168.1.94,TLSv1.3,822,"Application Data, Application Data, Application Data",121,0x0,0x00,808
190,3.268161555,192.168.1.94,142.250.75.110,TCP,66,60366  >  443 [ACK] Seq=4977 Ack=161021 Win=343552 Len=0 TSval=1158783380 TSecr=2478395032,64,0x2,0x00,52
191,3.26990775,192.168.1.94,142.250.75.110,TLSv1.3,105,Application Data,64,0x2,0x00,91
192,3.28167046,142.250.75.110,192.168.1.94,TCP,66,443  >  60366 [ACK] Seq=161021 Ack=5016 Win=265728 Len=0 TSval=2478395044 TSecr=1158783383,121,0x0,0x00,52
193,3.293530639,142.250.75.110,192.168.1.94,TLSv1.3,155,Application Data,121,0x0,0x00,141
194,3.293531306,142.250.75.110,192.168.1.94,TLSv1.3,1466,Application Data,121,0x0,0x00,1452
195,3.293531326,142.250.75.110,192.168.1.94,TLSv1.3,1466,Application Data,121,0x0,0x00,1452
196,3.293531348,142.250.75.110,192.168.1.94,TLSv1.3,2866,"Application Data, Application Data",121,0x0,0x00,2852
197,3.293572005,192.168.1.94,142.250.75.110,TCP,66,60366  >  443 [ACK] Seq=5016 Ack=162510 Win=346368 Len=0 TSval=1158783406 TSecr=2478395059,64,0x2,0x00,52
198,3.293676228,192.168.1.94,142.250.75.110,TCP,66,60366  >  443 [ACK] Seq=5016 Ack=166710 Win=354816 Len=0 TSval=1158783406 TSecr=2478395059,64,0x2,0x00,52
199,3.300387232,142.250.75.110,192.168.1.94,TLSv1.3,1560,"Application Data, Application Data",121,0x0,0x00,1546
200,3.300387991,142.250.75.110,192.168.1.94,TLSv1.3,97,Application Data,121,0x0,0x00,83
201,3.300388048,142.250.75.110,192.168.1.94,TLSv1.3,105,Application Data,121,0x0,0x00,91
202,3.300408215,192.168.1.94,142.250.75.110,TCP,66,60366  >  443 [ACK] Seq=5016 Ack=168204 Win=357760 Len=0 TSval=1158783413 TSecr=2478395060,64,0x2,0x00,52
203,3.306888924,192.168.1.94,142.250.75.110,TCP,66,60366  >  443 [ACK] Seq=5016 Ack=168274 Win=357760 Len=0 TSval=1158783419 TSecr=2478395060,64,0x2,0x00,52
204,3.310884832,142.250.75.110,192.168.1.94,TLSv1.3,155,Application Data,121,0x0,0x00,141
205,3.310885135,142.250.75.110,192.168.1.94,TLSv1.3,1466,Application Data,121,0x0,0x00,1452
206,3.310885162,142.250.75.110,192.168.1.94,TLSv1.3,2866,"Application Data, Application Data",121,0x0,0x00,2852
207,3.310885189,142.250.75.110,192.168.1.94,TLSv1.3,2621,"Application Data, Application Data",121,0x0,0x00,2607
208,3.310885217,142.250.75.110,192.168.1.94,TLSv1.3,97,Application Data,121,0x0,0x00,83
209,3.310885251,142.250.75.110,192.168.1.94,TLSv1.3,155,Application Data,121,0x0,0x00,141
210,3.310943434,192.168.1.94,142.250.75.110,TCP,66,60366  >  443 [ACK] Seq=5016 Ack=169763 Win=360576 Len=0 TSval=1158783424 TSecr=2478395060,64,0x2,0x00,52
211,3.311551497,192.168.1.94,142.250.75.110,TCP,66,60366  >  443 [ACK] Seq=5016 Ack=172563 Win=366208 Len=0 TSval=1158783424 TSecr=2478395060,64,0x2,0x00,52
212,3.312617589,192.168.1.94,142.250.75.110,TCP,66,60366  >  443 [ACK] Seq=5016 Ack=175118 Win=371328 Len=0 TSval=1158783425 TSecr=2478395061,64,0x2,0x00,52
213,3.315428868,142.250.75.110,192.168.1.94,TLSv1.3,1466,Application Data,121,0x0,0x00,1452
214,3.31542895,142.250.75.110,192.168.1.94,TLSv1.3,1466,Application Data,121,0x0,0x00,1452
215,3.31542897,142.250.75.110,192.168.1.94,TLSv1.3,2866,"Application Data, Application Data",121,0x0,0x00,2852
216,3.315428996,142.250.75.110,192.168.1.94,TLSv1.3,1145,"Application Data, Application Data",121,0x0,0x00,1131
217,3.317001563,192.168.1.94,142.250.75.110,TLSv1.3,105,Application Data,64,0x2,0x00,91
218,3.317431384,192.168.1.94,142.250.75.110,TCP,66,60366  >  443 [ACK] Seq=5055 Ack=181917 Win=385536 Len=0 TSval=1158783430 TSecr=2478395061,64,0x2,0x00,52
219,3.328292752,142.250.75.110,192.168.1.94,TCP,66,443  >  60366 [ACK] Seq=181917 Ack=5055 Win=265728 Len=0 TSval=2478395095 TSecr=1158783430,121,0x0,0x00,52
220,3.954044495,192.168.1.94,142.250.75.110,TLSv1.3,185,Application Data,64,0x2,0x00,171
221,3.957408005,192.168.1.94,142.250.75.110,TLSv1.3,1322,Application Data,64,0x2,0x00,1308
222,3.9578069,192.168.1.94,142.250.75.110,TLSv1.3,2866,,64,0x2,0x00,2852
223,3.958232978,192.168.1.94,142.250.75.110,TCP,2866,"60366  >  443 [PSH, ACK] Seq=9230 Ack=181917 Win=385536 Len=2800 TSval=1158784070 TSecr=2478395095",64,0x2,0x00,2852
224,3.958473648,192.168.1.94,142.250.75.110,TLSv1.3,2866,Continuation Data,64,0x2,0x00,2852
225,3.958701984,192.168.1.94,142.250.75.110,TLSv1.3,663,Continuation Data,64,0x2,0x00,649
226,3.966219287,142.250.75.110,192.168.1.94,TCP,66,443  >  60366 [ACK] Seq=181917 Ack=5174 Win=265728 Len=0 TSval=2478395726 TSecr=1158784067,121,0x0,0x00,52
227,3.966219647,142.250.75.110,192.168.1.94,TCP,66,443  >  60366 [ACK] Seq=181917 Ack=6430 Win=264704 Len=0 TSval=2478395732 TSecr=1158784070,121,0x0,0x00,52
228,3.966219667,142.250.75.110,192.168.1.94,TCP,66,443  >  60366 [ACK] Seq=181917 Ack=7830 Win=263424 Len=0 TSval=2478395732 TSecr=1158784070,121,0x0,0x00,52
229,3.966425537,142.250.75.110,192.168.1.94,TCP,66,443  >  60366 [ACK] Seq=181917 Ack=9230 Win=262144 Len=0 TSval=2478395732 TSecr=1158784070,121,0x0,0x00,52
230,3.966425605,142.250.75.110,192.168.1.94,TCP,78,[TCP Dup ACK 229#1] 443  >  60366 [ACK] Seq=181917 Ack=9230 Win=262144 Len=0 TSval=2478395732 TSecr=1158784070 SLE=10630 SRE=12030,121,0x0,0x00,64
231,3.966425627,142.250.75.110,192.168.1.94,TCP,66,443  >  60366 [ACK] Seq=181917 Ack=12030 Win=259584 Len=0 TSval=2478395732 TSecr=1158784070,121,0x0,0x00,52
232,3.975571128,142.250.75.110,192.168.1.94,TCP,78,[TCP Dup ACK 231#1] 443  >  60366 [ACK] Seq=181917 Ack=12030 Win=259584 Len=0 TSval=2478395734 TSecr=1158784070 SLE=13430 SRE=14830,121,0x0,0x00,64
233,3.975571299,142.250.75.110,192.168.1.94,TCP,78,[TCP Dup ACK 231#2] 443  >  60366 [ACK] Seq=181917 Ack=12030 Win=259584 Len=0 TSval=2478395734 TSecr=1158784070 SLE=13430 SRE=15427,121,0x0,0x00,64
234,3.975571321,142.250.75.110,192.168.1.94,TCP,66,443  >  60366 [ACK] Seq=181917 Ack=15427 Win=256256 Len=0 TSval=2478395734 TSecr=1158784070,121,0x0,0x00,52
235,4.037147109,142.250.75.110,192.168.1.94,TLSv1.3,676,Application Data,121,0x0,0x00,662
236,4.037147442,142.250.75.110,192.168.1.94,TLSv1.3,128,Application Data,121,0x0,0x00,114
237,4.037147463,142.250.75.110,192.168.1.94,TLSv1.3,97,Application Data,121,0x0,0x00,83
238,4.037147484,142.250.75.110,192.168.1.94,TLSv1.3,105,Application Data,121,0x0,0x00,91
239,4.037813906,192.168.1.94,142.250.75.110,TCP,66,60366  >  443 [ACK] Seq=15427 Ack=182659 Win=388224 Len=0 TSval=1158784150 TSecr=2478395802,64,0x2,0x00,52
240,4.038279576,192.168.1.94,142.250.75.110,TLSv1.3,105,Application Data,64,0x2,0x00,91
241,4.052236136,142.250.75.110,192.168.1.94,TLSv1.3,580,Application Data,121,0x0,0x00,566
242,4.052236953,142.250.75.110,192.168.1.94,TLSv1.3,1466,Application Data,121,0x0,0x00,1452
243,4.052237096,142.250.75.110,192.168.1.94,TLSv1.3,1466,Application Data,121,0x0,0x00,1452
244,4.052237237,142.250.75.110,192.168.1.94,TLSv1.3,679,Application Data,121,0x0,0x00,665
245,4.05223737,142.250.75.110,192.168.1.94,TLSv1.3,98,Application Data,121,0x0,0x00,84
246,4.052237483,142.250.75.110,192.168.1.94,TLSv1.3,97,Application Data,121,0x0,0x00,83
247,4.052237703,142.250.75.110,192.168.1.94,TCP,66,443  >  60366 [ACK] Seq=186649 Ack=15466 Win=256256 Len=0 TSval=2478395815 TSecr=1158784151,121,0x0,0x00,52
248,4.067413165,192.168.1.94,142.250.75.110,TCP,66,60366  >  443 [ACK] Seq=15466 Ack=186649 Win=396160 Len=0 TSval=1158784180 TSecr=2478395814,64,0x2,0x00,52
249,4.222539358,192.168.1.94,142.250.75.110,TLSv1.3,445,Application Data,64,0x2,0x00,431
250,4.229432154,142.250.75.110,192.168.1.94,TCP,66,443  >  60366 [ACK] Seq=186649 Ack=15845 Win=256000 Len=0 TSval=2478395996 TSecr=1158784335,121,0x0,0x00,52
251,4.238904464,142.250.75.110,192.168.1.94,TLSv1.3,145,Application Data,121,0x0,0x00,131
252,4.245177325,192.168.1.94,142.250.75.110,TLSv1.3,105,Application Data,64,0x2,0x00,91
253,4.257133894,142.250.75.110,192.168.1.94,TCP,66,443  >  60366 [ACK] Seq=186728 Ack=15884 Win=256000 Len=0 TSval=2478396023 TSecr=1158784358,121,0x0,0x00,52
254,4.472229215,192.168.1.94,142.250.75.110,TLSv1.3,579,Application Data,64,0x2,0x00,565
255,4.472406251,192.168.1.94,142.250.75.110,TLSv1.3,1279,Application Data,64,0x2,0x00,1265
256,4.472986432,192.168.1.94,142.250.75.110,TLSv1.3,578,Application Data,64,0x2,0x00,564
257,4.474081093,192.168.1.94,142.250.75.110,TLSv1.3,296,Application Data,64,0x2,0x00,282
258,4.47420186,192.168.1.94,142.250.75.110,TLSv1.3,451,Application Data,64,0x2,0x00,437
259,4.47939504,142.250.75.110,192.168.1.94,TCP,66,443  >  60366 [ACK] Seq=186728 Ack=16397 Win=255488 Len=0 TSval=2478396246 TSecr=1158784585,121,0x0,0x00,52
260,4.479395197,142.250.75.110,192.168.1.94,TCP,66,443  >  60366 [ACK] Seq=186728 Ack=17610 Win=254464 Len=0 TSval=2478396246 TSecr=1158784585,121,0x0,0x00,52
261,4.481390689,142.250.75.110,192.168.1.94,TCP,66,443  >  60366 [ACK] Seq=186728 Ack=18122 Win=253952 Len=0 TSval=2478396248 TSecr=1158784586,121,0x0,0x00,52
262,4.481390856,142.250.75.110,192.168.1.94,TCP,66,443  >  60366 [ACK] Seq=186728 Ack=18352 Win=253952 Len=0 TSval=2478396248 TSecr=1158784587,121,0x0,0x00,52
263,4.481390877,142.250.75.110,192.168.1.94,TCP,66,443  >  60366 [ACK] Seq=186728 Ack=18737 Win=253696 Len=0 TSval=2478396248 TSecr=1158784587,121,0x0,0x00,52
264,4.502120766,192.168.1.94,142.250.75.110,TLSv1.3,1165,Application Data,64,0x2,0x00,1151
265,4.502237749,192.168.1.94,142.250.75.110,TLSv1.3,1812,Application Data,64,0x2,0x00,1798
266,4.510547835,142.250.75.110,192.168.1.94,TCP,66,443  >  60366 [ACK] Seq=186728 Ack=19836 Win=252672 Len=0 TSval=2478396277 TSecr=1158784615,121,0x0,0x00,52
267,4.512295667,142.250.75.110,192.168.1.94,TCP,78,[TCP Dup ACK 266#1] 443  >  60366 [ACK] Seq=186728 Ack=19836 Win=252672 Len=0 TSval=2478396277 TSecr=1158784615 SLE=21236 SRE=21582,121,0x0,0x00,64
268,4.512295867,142.250.75.110,192.168.1.94,TCP,66,443  >  60366 [ACK] Seq=186728 Ack=21582 Win=251136 Len=0 TSval=2478396277 TSecr=1158784615,121,0x0,0x00,52
269,4.547638783,142.250.75.110,192.168.1.94,TLSv1.3,306,Application Data,121,0x0,0x00,292
270,4.54763912,142.250.75.110,192.168.1.94,TLSv1.3,1466,Application Data,121,0x0,0x00,1452
271,4.54763914,142.250.75.110,192.168.1.94,TLSv1.3,513,Application Data,121,0x0,0x00,499
272,4.547639162,142.250.75.110,192.168.1.94,TLSv1.3,137,Application Data,121,0x0,0x00,123
273,4.547639182,142.250.75.110,192.168.1.94,TLSv1.3,1466,Application Data,121,0x0,0x00,1452
274,4.547639204,142.250.75.110,192.168.1.94,TLSv1.3,513,Application Data,121,0x0,0x00,499
275,4.547639224,142.250.75.110,192.168.1.94,TLSv1.3,97,Application Data,121,0x0,0x00,83
276,4.547639244,142.250.75.110,192.168.1.94,TLSv1.3,105,Application Data,121,0x0,0x00,91
277,4.547708235,192.168.1.94,142.250.75.110,TCP,66,60366  >  443 [ACK] Seq=21582 Ack=188368 Win=401792 Len=0 TSval=1158784660 TSecr=2478396304,64,0x2,0x00,52
278,4.547860176,192.168.1.94,142.250.75.110,TCP,66,60366  >  443 [ACK] Seq=21582 Ack=190286 Win=407296 Len=0 TSval=1158784660 TSecr=2478396304,64,0x2,0x00,52
279,4.547947398,142.250.75.110,192.168.1.94,TLSv1.3,97,Application Data,121,0x0,0x00,83
280,4.548228846,192.168.1.94,142.250.75.110,TLSv1.3,105,Application Data,64,0x2,0x00,91
281,4.562193597,142.250.75.110,192.168.1.94,TCP,66,443  >  60366 [ACK] Seq=190834 Ack=21621 Win=251136 Len=0 TSval=2478396327 TSecr=1158784661,121,0x0,0x00,52
282,4.570017116,142.250.75.110,192.168.1.94,TLSv1.3,172,Application Data,121,0x0,0x00,158
283,4.570017448,142.250.75.110,192.168.1.94,TLSv1.3,327,Application Data,121,0x0,0x00,313
284,4.57001747,142.250.75.110,192.168.1.94,TLSv1.3,97,Application Data,121,0x0,0x00,83
285,4.570017491,142.250.75.110,192.168.1.94,TLSv1.3,105,Application Data,121,0x0,0x00,91
286,4.571744102,192.168.1.94,142.250.75.110,TCP,66,60366  >  443 [ACK] Seq=21621 Ack=191271 Win=412928 Len=0 TSval=1158784684 TSecr=2478396336,64,0x2,0x00,52
287,4.571946685,192.168.1.94,142.250.75.110,TLSv1.3,105,Application Data,64,0x2,0x00,91
288,4.583846501,142.250.75.110,192.168.1.94,TCP,66,443  >  60366 [ACK] Seq=191271 Ack=21660 Win=251136 Len=0 TSval=2478396349 TSecr=1158784685,121,0x0,0x00,52
289,4.730414452,192.168.1.94,142.250.75.110,TCP,74,40474  >  443 [SYN] Seq=0 Win=64240 Len=0 MSS=1460 SACK_PERM TSval=1158784843 TSecr=0 WS=128,64,0x2,0x00,60
290,4.736903873,142.250.75.110,192.168.1.94,TCP,74,"443  >  40474 [SYN, ACK] Seq=0 Ack=1 Win=65535 Len=0 MSS=1412 SACK_PERM TSval=4293821766 TSecr=1158784843 WS=256",123,0x2,0x00,60
291,4.736974213,192.168.1.94,142.250.75.110,TCP,66,40474  >  443 [ACK] Seq=1 Ack=1 Win=64256 Len=0 TSval=1158784850 TSecr=4293821766,64,0x2,0x00,52
292,4.740583723,192.168.1.94,142.250.75.110,TLSv1.3,583,Client Hello (SNI=play.google.com),64,0x2,0x00,569
293,4.746422484,142.250.75.110,192.168.1.94,TCP,66,443  >  40474 [ACK] Seq=1 Ack=518 Win=268288 Len=0 TSval=4293821776 TSecr=1158784853,123,0x0,0x00,52
294,4.804325094,142.250.75.110,192.168.1.94,TLSv1.3,5666,"Server Hello, Change Cipher Spec",123,0x0,0x00,5652
295,4.804325403,142.250.75.110,192.168.1.94,TLSv1.3,1050,Continuation Data,123,0x0,0x00,1036
296,4.804398468,192.168.1.94,142.250.75.110,TCP,66,40474  >  443 [ACK] Seq=518 Ack=5601 Win=75392 Len=0 TSval=1158784917 TSecr=4293821833,64,0x2,0x00,52
297,4.804492666,192.168.1.94,142.250.75.110,TCP,66,40474  >  443 [ACK] Seq=518 Ack=6585 Win=78208 Len=0 TSval=1158784917 TSecr=4293821833,64,0x2,0x00,52
298,4.812975229,192.168.1.94,142.250.75.110,TLSv1.3,130,"Change Cipher Spec, Application Data",64,0x2,0x00,116
299,4.813296483,192.168.1.94,142.250.75.110,TLSv1.3,253,Application Data,64,0x2,0x00,239
300,4.817856557,142.250.75.110,192.168.1.94,TCP,66,443  >  40474 [ACK] Seq=6585 Ack=582 Win=268800 Len=0 TSval=4293821848 TSecr=1158784926,123,0x0,0x00,52
301,4.817856743,142.250.75.110,192.168.1.94,TCP,66,443  >  40474 [ACK] Seq=6585 Ack=769 Win=268800 Len=0 TSval=4293821848 TSecr=1158784926,123,0x0,0x00,52
302,4.817856802,142.250.75.110,192.168.1.94,TLSv1.3,680,"Application Data, Application Data",123,0x0,0x00,666
303,4.818601543,192.168.1.94,142.250.75.110,TLSv1.3,90,Application Data,64,0x2,0x00,76
304,4.818726451,192.168.1.94,142.250.75.110,TCP,66,"40474  >  443 [FIN, ACK] Seq=793 Ack=7199 Win=80896 Len=0 TSval=1158784931 TSecr=4293821849",64,0x2,0x00,52
305,4.820108316,142.250.75.110,192.168.1.94,TLSv1.3,97,Application Data,123,0x0,0x00,83
306,4.820136494,192.168.1.94,142.250.75.110,TCP,54,40474  >  443 [RST] Seq=769 Win=0 Len=0,64,0x2,0x00,40
307,4.82398907,142.250.75.110,192.168.1.94,TCP,66,"443  >  40474 [FIN, ACK] Seq=7230 Ack=794 Win=268800 Len=0 TSval=4293821854 TSecr=1158784931",123,0x0,0x00,52
308,4.824014482,192.168.1.94,142.250.75.110,TCP,54,40474  >  443 [RST] Seq=794 Win=0 Len=0,64,0x2,0x00,40
309,6.1769338,192.168.1.94,142.250.75.110,TLSv1.3,2203,Application Data,64,0x2,0x00,2189
310,6.177320011,192.168.1.94,142.250.75.110,TLSv1.3,2866,,64,0x2,0x00,2852
311,6.177564523,192.168.1.94,142.250.75.110,TLSv1.3,89,Continuation Data,64,0x2,0x00,75
312,6.191707054,142.250.75.110,192.168.1.94,TCP,78,[TCP Dup ACK 288#1] 443  >  60366 [ACK] Seq=191271 Ack=21660 Win=251136 Len=0 TSval=2478397951 TSecr=1158784685 SLE=23060 SRE=23797,121,0x0,0x00,64
313,6.191707738,142.250.75.110,192.168.1.94,TCP,66,443  >  60366 [ACK] Seq=191271 Ack=23797 Win=249088 Len=0 TSval=2478397951 TSecr=1158786290,121,0x0,0x00,52
314,6.19170778,142.250.75.110,192.168.1.94,TCP,78,[TCP Dup ACK 313#1] 443  >  60366 [ACK] Seq=191271 Ack=23797 Win=249088 Len=0 TSval=2478397951 TSecr=1158786290 SLE=25197 SRE=26597,121,0x0,0x00,64
315,6.1917078,142.250.75.110,192.168.1.94,TCP,78,[TCP Dup ACK 313#2] 443  >  60366 [ACK] Seq=191271 Ack=23797 Win=249088 Len=0 TSval=2478397951 TSecr=1158786290 SLE=25197 SRE=26620,121,0x0,0x00,64
316,6.191707819,142.250.75.110,192.168.1.94,TCP,66,443  >  60366 [ACK] Seq=191271 Ack=26620 Win=246272 Len=0 TSval=2478397951 TSecr=1158786290,121,0x0,0x00,52
317,6.211001021,192.168.1.94,142.250.75.110,TLSv1.3,2866,,64,0x2,0x00,2852
318,6.211122267,192.168.1.94,142.250.75.110,TLSv1.3,324,Continuation Data,64,0x2,0x00,310
319,6.211326617,192.168.1.94,142.250.75.110,TLSv1.3,2866,,64,0x2,0x00,2852
320,6.211609298,192.168.1.94,142.250.75.110,TLSv1.3,709,Continuation Data,64,0x2,0x00,695
321,6.217974897,192.168.1.94,142.250.75.110,TLSv1.3,2866,,64,0x2,0x00,2852
322,6.218276053,192.168.1.94,142.250.75.110,TLSv1.3,2866,Continuation Data,64,0x2,0x00,2852
323,6.221387169,142.250.75.110,192.168.1.94,TCP,66,443  >  60366 [ACK] Seq=191271 Ack=28020 Win=244992 Len=0 TSval=2478397988 TSecr=1158786323,121,0x0,0x00,52
324,6.221387198,142.250.75.110,192.168.1.94,TCP,66,443  >  60366 [ACK] Seq=191271 Ack=29420 Win=243712 Len=0 TSval=2478397988 TSecr=1158786323,121,0x0,0x00,52
325,6.221387218,142.250.75.110,192.168.1.94,TCP,66,443  >  60366 [ACK] Seq=191271 Ack=29678 Win=243456 Len=0 TSval=2478397988 TSecr=1158786323,121,0x0,0x00,52
326,6.221387266,142.250.75.110,192.168.1.94,TCP,66,443  >  60366 [ACK] Seq=191271 Ack=33121 Win=240128 Len=0 TSval=2478397988 TSecr=1158786324,121,0x0,0x00,52
327,6.221515457,192.168.1.94,142.250.75.110,TLSv1.3,1050,Continuation Data,64,0x2,0x00,1036
328,6.235374518,142.250.75.110,192.168.1.94,TCP,66,443  >  60366 [ACK] Seq=191271 Ack=34521 Win=238848 Len=0 TSval=2478397994 TSecr=1158786331,121,0x0,0x00,52
329,6.23689027,142.250.75.110,192.168.1.94,TCP,66,443  >  60366 [ACK] Seq=191271 Ack=35921 Win=237568 Len=0 TSval=2478397995 TSecr=1158786331,121,0x0,0x00,52
330,6.236890457,142.250.75.110,192.168.1.94,TCP,66,443  >  60366 [ACK] Seq=191271 Ack=37321 Win=236288 Len=0 TSval=2478397995 TSecr=1158786331,121,0x0,0x00,52
331,6.236890478,142.250.75.110,192.168.1.94,TCP,66,443  >  60366 [ACK] Seq=191271 Ack=38721 Win=235008 Len=0 TSval=2478397996 TSecr=1158786331,121,0x0,0x00,52
