No.,Time,Source,Destination,Protocol,Length,Info,TTL,Flags,DSCP,LEN
1,0,192.168.1.93,159.124.21.96,TCP,74,45230  >  443 [SYN] Seq=0 Win=64240 Len=0 MSS=1460 SACK_PERM TSval=1495220937 TSecr=0 WS=128,64,0x2,0x00,60
2,0.081464633,159.124.21.96,192.168.1.93,TCP,74,"443  >  45230 [SYN, ACK] Seq=0 Ack=1 Win=65160 Len=0 MSS=1460 SACK_PERM TSval=4109506945 TSecr=1495220937 WS=128",45,0x2,0x00,60
3,0.089141801,192.168.1.93,159.124.21.96,TCP,66,45230  >  443 [ACK] Seq=1 Ack=1 Win=64256 Len=0 TSval=1495221022 TSecr=4109506945,64,0x2,0x00,52
4,0.100092812,192.168.1.93,159.124.21.96,TLSv1.3,583,Client Hello (SNI=zoomams1591242196rwg.ams.zoom.us),64,0x2,0x00,569
5,0.235067641,159.124.21.96,192.168.1.93,TCP,66,443  >  45230 [ACK] Seq=1 Ack=518 Win=64768 Len=0 TSval=4109507087 TSecr=1495221037,45,0x2,0x00,52
6,0.23506798,159.124.21.96,192.168.1.93,TLSv1.3,2962,"Server Hello, Change Cipher Spec, Application Data",45,0x2,0x00,2948
7,0.235068001,159.124.21.96,192.168.1.93,TLSv1.3,1266,Continuation Data,45,0x2,0x00,1252
8,0.235068089,159.124.21.96,192.168.1.93,TLSv1.3,466,Continuation Data,45,0x2,0x00,452
9,0.236492796,192.168.1.93,159.124.21.96,TCP,66,45230  >  443 [ACK] Seq=518 Ack=2897 Win=69888 Len=0 TSval=1495221172 TSecr=4109507087,64,0x2,0x00,52
10,0.236675065,192.168.1.93,159.124.21.96,TCP,66,45230  >  443 [ACK] Seq=518 Ack=4097 Win=72832 Len=0 TSval=1495221174 TSecr=4109507087,64,0x2,0x00,52
11,0.236762009,192.168.1.93,159.124.21.96,TCP,66,45230  >  443 [ACK] Seq=518 Ack=4497 Win=75776 Len=0 TSval=1495221174 TSecr=4109507088,64,0x2,0x00,52
12,0.258854296,192.168.1.93,159.124.21.96,TLSv1.3,146,"Change Cipher Spec, Application Data",64,0x2,0x00,132
13,0.262655924,192.168.1.93,159.124.21.96,TLSv1.3,2962,,64,0x2,0x00,2948
14,0.263280913,192.168.1.93,159.124.21.96,TLSv1.3,1917,Continuation Data,64,0x2,0x00,1903
15,0.353665162,159.124.21.96,192.168.1.93,TCP,66,443  >  45230 [ACK] Seq=4497 Ack=2046 Win=64128 Len=0 TSval=4109507223 TSecr=1495221196,45,0x2,0x00,52
16,0.354516049,159.124.21.96,192.168.1.93,TCP,66,443  >  45230 [ACK] Seq=4497 Ack=4942 Win=64128 Len=0 TSval=4109507223 TSecr=1495221200,45,0x2,0x00,52
17,0.354516233,159.124.21.96,192.168.1.93,TLSv1.3,145,Application Data,45,0x2,0x00,131
18,0.354516254,159.124.21.96,192.168.1.93,TLSv1.3,145,Application Data,45,0x2,0x00,131
19,0.362389085,192.168.1.93,159.124.21.96,TCP,66,45230  >  443 [ACK] Seq=5345 Ack=4655 Win=75776 Len=0 TSval=1495221300 TSecr=4109507223,64,0x2,0x00,52
20,0.419294889,159.124.21.96,192.168.1.93,TLSv1.3,533,Application Data,45,0x2,0x00,519
21,0.419295507,159.124.21.96,192.168.1.93,TLSv1.3,831,Application Data,45,0x2,0x00,817
22,0.459465811,192.168.1.93,159.124.21.96,TCP,66,45230  >  443 [ACK] Seq=5345 Ack=5887 Win=81536 Len=0 TSval=1495221397 TSecr=4109507270,64,0x2,0x00,52
23,0.536909033,192.168.1.93,159.124.21.96,TLSv1.3,111,Application Data,64,0x2,0x00,97
24,0.652385941,159.124.21.96,192.168.1.93,TLSv1.3,107,Application Data,45,0x2,0x00,93
25,0.652512647,192.168.1.93,159.124.21.96,TCP,66,45230  >  443 [ACK] Seq=5390 Ack=5928 Win=81536 Len=0 TSval=1495221590 TSecr=4109507513,64,0x2,0x00,52
26,1.352307859,192.168.1.93,159.124.21.96,TLSv1.3,713,Application Data,64,0x2,0x00,699
27,1.352760497,192.168.1.93,159.124.21.96,TLSv1.3,713,Application Data,64,0x2,0x00,699
28,1.429566632,159.124.21.96,192.168.1.93,TCP,66,443  >  45230 [ACK] Seq=5928 Ack=6684 Win=64128 Len=0 TSval=4109508299 TSecr=1495222289,45,0x2,0x00,52
29,1.429566972,159.124.21.96,192.168.1.93,TLSv1.3,807,Application Data,45,0x2,0x00,793
30,1.429636657,192.168.1.93,159.124.21.96,TCP,66,45230  >  443 [ACK] Seq=6684 Ack=6669 Win=84480 Len=0 TSval=1495222367 TSecr=4109508299,64,0x2,0x00,52
31,1.451885388,159.124.21.96,192.168.1.93,TLSv1.3,808,Application Data,45,0x2,0x00,794
32,1.451907778,192.168.1.93,159.124.21.96,TCP,66,45230  >  443 [ACK] Seq=6684 Ack=7411 Win=87296 Len=0 TSval=1495222389 TSecr=4109508319,64,0x2,0x00,52
33,1.465770533,192.168.1.93,159.124.21.96,STUN,198,Binding Request user: 4D4E1327-1ADF-8C9D-33B1-B59FB236C0B7:4541BB66-D689-8DE7-07EF-2C88144219B5,64,0x2,0x00,184
34,1.541915553,159.124.21.96,192.168.1.93,STUN,106,Binding Success Response XOR-MAPPED-ADDRESS: 5.29.51.201:8466,44,0x2,0x00,92
35,1.543359929,192.168.1.93,159.124.21.96,STUN,198,Binding Request user: 4D4E1327-1ADF-8C9D-33B1-B59FB236C0B7:4541BB66-D689-8DE7-07EF-2C88144219B5,64,0x2,0x00,184
36,1.543942677,192.168.1.93,159.124.21.96,DTLSv1.2,231,Client Hello,64,0x2,0x00,217
37,1.582269058,192.168.1.93,159.124.21.96,STUN,198,Binding Request user: 6F4AA7FD-78DF-FCC4-F05B-958B6A09AE9D:4541BB66-D689-8DE7-07EF-2C88144219B5,64,0x2,0x00,184
38,1.601655268,192.168.1.93,159.124.21.96,DTLSv1.2,231,Client Hello,64,0x2,0x00,217
39,1.614033586,159.124.21.96,192.168.1.93,STUN,106,Binding Success Response XOR-MAPPED-ADDRESS: 5.29.51.201:8466,44,0x2,0x00,92
40,1.61403383,159.124.21.96,192.168.1.93,DTLSv1.2,1094,"Server Hello, Certificate (Fragment)",44,0x2,0x00,1080
41,1.614033873,159.124.21.96,192.168.1.93,DTLSv1.2,1094,Certificate (Fragment),44,0x2,0x00,1080
42,1.614033925,159.124.21.96,192.168.1.93,DTLSv1.2,1094,Certificate (Fragment),44,0x2,0x00,1080
43,1.61704053,159.124.21.96,192.168.1.93,DTLSv1.2,1094,"Certificate (Reassembled), Server Key Exchange (Fragment)",44,0x2,0x00,1080
44,1.617040793,159.124.21.96,192.168.1.93,DTLSv1.2,492,"Server Key Exchange (Reassembled), Certificate Request, Server Hello Done",44,0x2,0x00,478
45,1.623399872,192.168.1.93,159.124.21.96,DTLSv1.2,659,"Certificate, Client Key Exchange, Certificate Verify, Change Cipher Spec, Encrypted Handshake Message",64,0x2,0x00,645
46,1.653749255,159.124.21.96,192.168.1.93,STUN,106,Binding Success Response XOR-MAPPED-ADDRESS: 5.29.51.201:8466,44,0x2,0x00,92
47,1.655296626,192.168.1.93,159.124.21.96,STUN,198,Binding Request user: 6F4AA7FD-78DF-FCC4-F05B-958B6A09AE9D:4541BB66-D689-8DE7-07EF-2C88144219B5,64,0x2,0x00,184
48,1.671657616,192.168.1.93,159.124.21.96,DTLSv1.2,231,Client Hello,64,0x2,0x00,217
49,1.67349966,159.124.21.96,192.168.1.93,DTLSv1.2,156,Server Hello,44,0x2,0x00,142
50,1.673499915,159.124.21.96,192.168.1.93,DTLSv1.2,1094,Certificate (Fragment),44,0x2,0x00,1080
51,1.67349995,159.124.21.96,192.168.1.93,DTLSv1.2,1094,Certificate (Fragment),44,0x2,0x00,1080
52,1.673499972,159.124.21.96,192.168.1.93,DTLSv1.2,1094,Certificate (Fragment),44,0x2,0x00,1080
53,1.673499993,159.124.21.96,192.168.1.93,DTLSv1.2,953,Certificate (Reassembled),44,0x2,0x00,939
54,1.673500013,159.124.21.96,192.168.1.93,DTLSv1.2,396,Server Key Exchange,44,0x2,0x00,382
55,1.673500033,159.124.21.96,192.168.1.93,DTLSv1.2,115,Certificate Request,44,0x2,0x00,101
56,1.673500054,159.124.21.96,192.168.1.93,DTLSv1.2,67,Server Hello Done,44,0x2,0x00,53
57,1.678264658,192.168.1.93,159.124.21.96,DTLSv1.2,659,"Certificate, Client Key Exchange, Certificate Verify, Change Cipher Spec, Encrypted Handshake Message",64,0x2,0x00,645
58,1.701800244,159.124.21.96,192.168.1.93,DTLSv1.2,109,"Change Cipher Spec, Encrypted Handshake Message",44,0x2,0x00,95
59,1.710025153,192.168.1.93,159.124.21.96,DTLSv1.2,115,Application Data,64,0x2,0x00,101
60,1.729014384,192.168.1.93,159.124.21.96,DTLSv1.2,231,Client Hello,64,0x2,0x00,217
61,1.730653729,159.124.21.96,192.168.1.93,STUN,106,Binding Success Response XOR-MAPPED-ADDRESS: 5.29.51.201:8466,44,0x2,0x00,92
62,1.752385409,159.124.21.96,192.168.1.93,DTLSv1.2,1094,"Server Hello, Certificate (Fragment)",44,0x2,0x00,1080
63,1.752385777,159.124.21.96,192.168.1.93,DTLSv1.2,1094,Certificate (Fragment),44,0x2,0x00,1080
64,1.752385845,159.124.21.96,192.168.1.93,DTLSv1.2,1094,Certificate (Fragment),44,0x2,0x00,1080
65,1.752385863,159.124.21.96,192.168.1.93,DTLSv1.2,1094,"Certificate (Reassembled), Server Key Exchange (Fragment)",44,0x2,0x00,1080
66,1.752385884,159.124.21.96,192.168.1.93,DTLSv1.2,492,"Server Key Exchange (Reassembled), Certificate Request, Server Hello Done",44,0x2,0x00,478
67,1.75238594,159.124.21.96,192.168.1.93,DTLSv1.2,60,Change Cipher Spec,44,0x2,0x00,42
68,1.75238596,159.124.21.96,192.168.1.93,DTLSv1.2,95,Encrypted Handshake Message,44,0x2,0x00,81
69,1.77137968,192.168.1.93,159.124.21.96,DTLSv1.2,659,"Certificate, Client Key Exchange, Certificate Verify, Change Cipher Spec, Encrypted Handshake Message",64,0x2,0x00,645
70,1.778383746,159.124.21.96,192.168.1.93,DTLSv1.2,115,Application Data,44,0x2,0x00,101
71,1.780895327,192.168.1.93,159.124.21.96,DTLSv1.2,91,Application Data,64,0x2,0x00,77
72,1.802665082,159.124.21.96,192.168.1.93,DTLSv1.2,156,Server Hello,44,0x2,0x00,142
73,1.802665374,159.124.21.96,192.168.1.93,DTLSv1.2,1094,Certificate (Fragment),44,0x2,0x00,1080
74,1.802665403,159.124.21.96,192.168.1.93,DTLSv1.2,1094,Certificate (Fragment),44,0x2,0x00,1080
75,1.802665424,159.124.21.96,192.168.1.93,DTLSv1.2,1094,Certificate (Fragment),44,0x2,0x00,1080
76,1.802665445,159.124.21.96,192.168.1.93,DTLSv1.2,953,Certificate (Reassembled),44,0x2,0x00,939
77,1.802665465,159.124.21.96,192.168.1.93,DTLSv1.2,396,Server Key Exchange,44,0x2,0x00,382
78,1.802665489,159.124.21.96,192.168.1.93,DTLSv1.2,115,Certificate Request,44,0x2,0x00,101
79,1.802665509,159.124.21.96,192.168.1.93,DTLSv1.2,67,Server Hello Done,44,0x2,0x00,53
80,1.805600955,192.168.1.93,159.124.21.96,DTLSv1.2,659,"Certificate, Client Key Exchange, Certificate Verify, Change Cipher Spec, Encrypted Handshake Message",64,0x2,0x00,645
81,1.849034782,159.124.21.96,192.168.1.93,DTLSv1.2,109,"Change Cipher Spec, Encrypted Handshake Message",44,0x2,0x00,95
82,1.850135554,159.124.21.96,192.168.1.93,DTLSv1.2,87,Application Data,44,0x2,0x00,73
83,1.850754356,192.168.1.93,159.124.21.96,DTLSv1.2,115,Application Data,64,0x2,0x00,101
84,1.851938689,192.168.1.93,159.124.21.96,DTLSv1.2,143,Application Data,64,0x2,0x00,129
85,1.887074183,159.124.21.96,192.168.1.93,DTLSv1.2,60,Change Cipher Spec,44,0x2,0x00,42
86,1.887074619,159.124.21.96,192.168.1.93,DTLSv1.2,95,Encrypted Handshake Message,44,0x2,0x00,81
87,1.920080067,159.124.21.96,192.168.1.93,DTLSv1.2,103,Application Data,44,0x2,0x00,89
88,1.920080563,159.124.21.96,192.168.1.93,DTLSv1.2,99,Application Data,44,0x2,0x00,85
89,1.923191237,159.124.21.96,192.168.1.93,DTLSv1.2,115,Application Data,44,0x2,0x00,101
90,1.929292783,192.168.1.93,159.124.21.96,DTLSv1.2,99,Application Data,64,0x2,0x00,85
91,1.932617333,192.168.1.93,159.124.21.96,DTLSv1.2,91,Application Data,64,0x2,0x00,77
92,2.012997837,159.124.21.96,192.168.1.93,DTLSv1.2,87,Application Data,44,0x2,0x00,73
93,2.021541529,192.168.1.93,159.124.21.96,DTLSv1.2,143,Application Data,64,0x2,0x00,129
94,2.094996366,159.124.21.96,192.168.1.93,DTLSv1.2,103,Application Data,44,0x2,0x00,89
95,2.094996677,159.124.21.96,192.168.1.93,DTLSv1.2,99,Application Data,44,0x2,0x00,85
96,2.095885796,192.168.1.93,159.124.21.96,DTLSv1.2,99,Application Data,64,0x2,0x00,85
97,4.534666758,159.124.21.96,192.168.1.93,DTLSv1.2,103,Application Data,44,0x2,0x00,89
98,4.536713171,192.168.1.93,159.124.21.96,DTLSv1.2,103,Application Data,64,0x2,0x00,89
99,4.652845794,159.124.21.96,192.168.1.93,DTLSv1.2,103,Application Data,44,0x2,0x00,89
100,4.653834586,192.168.1.93,159.124.21.96,DTLSv1.2,103,Application Data,64,0x2,0x00,89
101,5.740606852,159.124.21.96,192.168.1.93,TLSv1.3,106,Application Data,45,0x2,0x00,92
102,5.740733581,192.168.1.93,159.124.21.96,TCP,66,45230  >  443 [ACK] Seq=6684 Ack=7451 Win=87296 Len=0 TSval=1495226678 TSecr=4109512600,64,0x2,0x00,52
103,5.742404866,192.168.1.93,159.124.21.96,TLSv1.3,110,Application Data,64,0x2,0x00,96
104,5.865516429,159.124.21.96,192.168.1.93,TCP,66,443  >  45230 [ACK] Seq=7451 Ack=6728 Win=64128 Len=0 TSval=4109512726 TSecr=1495226680,45,0x2,0x00,52
105,6.092359378,192.168.1.93,159.124.21.96,TLSv1.3,209,Application Data,64,0x2,0x00,195
106,6.168678043,159.124.21.96,192.168.1.93,TCP,66,443  >  45230 [ACK] Seq=7451 Ack=6871 Win=64128 Len=0 TSval=4109513037 TSecr=1495227029,45,0x2,0x00,52
107,6.195661747,192.168.1.93,159.124.21.96,STUN,194,Binding Request user: 4D4E1327-1ADF-8C9D-33B1-B59FB236C0B7:4541BB66-D689-8DE7-07EF-2C88144219B5,64,0x2,0x00,180
108,6.265015658,159.124.21.96,192.168.1.93,STUN,106,Binding Success Response XOR-MAPPED-ADDRESS: 5.29.51.201:8466,44,0x2,0x00,92
109,6.963156951,159.124.21.96,192.168.1.93,TLSv1.3,1026,Application Data,45,0x2,0x00,1012
110,7.009706587,192.168.1.93,159.124.21.96,TCP,66,45230  >  443 [ACK] Seq=6871 Ack=8411 Win=90240 Len=0 TSval=1495227947 TSecr=4109513833,64,0x2,0x00,52
111,7.095289792,159.124.21.96,192.168.1.93,TLSv1.3,1278,Application Data,45,0x2,0x00,1264
112,7.095354926,192.168.1.93,159.124.21.96,TCP,66,45230  >  443 [ACK] Seq=6871 Ack=9623 Win=91136 Len=0 TSval=1495228032 TSecr=4109513965,64,0x2,0x00,52
113,7.129515886,159.124.21.96,192.168.1.93,TLSv1.3,2962,,45,0x2,0x00,2948
114,7.129516183,159.124.21.96,192.168.1.93,TLSv1.3,1288,Continuation Data,45,0x2,0x00,1274
115,7.129516362,159.124.21.96,192.168.1.93,TLSv1.3,2962,,45,0x2,0x00,2948
116,7.129516384,159.124.21.96,192.168.1.93,TLSv1.3,2962,Continuation Data,45,0x2,0x00,2948
117,7.129546758,192.168.1.93,159.124.21.96,TCP,66,45230  >  443 [ACK] Seq=6871 Ack=12519 Win=89856 Len=0 TSval=1495228067 TSecr=4109513986,64,0x2,0x00,52
118,7.130471021,192.168.1.93,159.124.21.96,TCP,66,45230  >  443 [ACK] Seq=6871 Ack=13741 Win=88704 Len=0 TSval=1495228068 TSecr=4109513989,64,0x2,0x00,52
119,7.130550921,192.168.1.93,159.124.21.96,TCP,66,45230  >  443 [ACK] Seq=6871 Ack=16637 Win=85888 Len=0 TSval=1495228068 TSecr=4109513991,64,0x2,0x00,52
120,7.130616291,192.168.1.93,159.124.21.96,TCP,66,45230  >  443 [ACK] Seq=6871 Ack=19533 Win=83072 Len=0 TSval=1495228068 TSecr=4109513998,64,0x2,0x00,52
121,7.137615412,159.124.21.96,192.168.1.93,TLSv1.3,2962,Continuation Data,45,0x2,0x00,2948
122,7.137638424,192.168.1.93,159.124.21.96,TCP,66,45230  >  443 [ACK] Seq=6871 Ack=22429 Win=89856 Len=0 TSval=1495228075 TSecr=4109514004,64,0x2,0x00,52
123,7.142623074,159.124.21.96,192.168.1.93,TLSv1.3,2962,Continuation Data,45,0x2,0x00,2948
124,7.142648654,192.168.1.93,159.124.21.96,TCP,66,45230  >  443 [ACK] Seq=6871 Ack=25325 Win=89856 Len=0 TSval=1495228080 TSecr=4109514010,64,0x2,0x00,52
125,7.151625447,159.124.21.96,192.168.1.93,TLSv1.3,2962,,45,0x2,0x00,2948
126,7.151657889,192.168.1.93,159.124.21.96,TCP,66,45230  >  443 [ACK] Seq=6871 Ack=28221 Win=89856 Len=0 TSval=1495228089 TSecr=4109514016,64,0x2,0x00,52
127,7.154476512,159.124.21.96,192.168.1.93,TLSv1.3,2962,Continuation Data,45,0x2,0x00,2948
128,7.154498986,192.168.1.93,159.124.21.96,TCP,66,45230  >  443 [ACK] Seq=6871 Ack=31117 Win=89856 Len=0 TSval=1495228092 TSecr=4109514022,64,0x2,0x00,52
129,7.161150903,159.124.21.96,192.168.1.93,TLSv1.3,2962,Continuation Data,45,0x2,0x00,2948
130,7.161184833,192.168.1.93,159.124.21.96,TCP,66,45230  >  443 [ACK] Seq=6871 Ack=34013 Win=89856 Len=0 TSval=1495228098 TSecr=4109514029,64,0x2,0x00,52
131,7.17234875,159.124.21.96,192.168.1.93,TLSv1.3,1514,Continuation Data,45,0x2,0x00,1500
132,7.172382376,192.168.1.93,159.124.21.96,TCP,66,45230  >  443 [ACK] Seq=6871 Ack=35461 Win=91136 Len=0 TSval=1495228110 TSecr=4109514039,64,0x2,0x00,52
133,7.211548118,159.124.21.96,192.168.1.93,TLSv1.3,2962,Continuation Data,45,0x2,0x00,2948
134,7.211548463,159.124.21.96,192.168.1.93,TLSv1.3,2962,Continuation Data,45,0x2,0x00,2948
135,7.211601357,192.168.1.93,159.124.21.96,TCP,66,45230  >  443 [ACK] Seq=6871 Ack=38357 Win=97024 Len=0 TSval=1495228149 TSecr=4109514073,64,0x2,0x00,52
136,7.211751854,192.168.1.93,159.124.21.96,TCP,66,45230  >  443 [ACK] Seq=6871 Ack=41253 Win=102784 Len=0 TSval=1495228149 TSecr=4109514076,64,0x2,0x00,52
137,7.217323775,159.124.21.96,192.168.1.93,TLSv1.3,2962,Continuation Data,45,0x2,0x00,2948
138,7.217349098,192.168.1.93,159.124.21.96,TCP,66,45230  >  443 [ACK] Seq=6871 Ack=44149 Win=108544 Len=0 TSval=1495228154 TSecr=4109514082,64,0x2,0x00,52
139,7.219870595,159.124.21.96,192.168.1.93,TLSv1.3,2962,Continuation Data,45,0x2,0x00,2948
140,7.219895744,192.168.1.93,159.124.21.96,TCP,66,45230  >  443 [ACK] Seq=6871 Ack=47045 Win=114304 Len=0 TSval=1495228157 TSecr=4109514089,64,0x2,0x00,52
141,7.227400816,159.124.21.96,192.168.1.93,TLSv1.3,2962,Continuation Data,45,0x2,0x00,2948
142,7.227429453,192.168.1.93,159.124.21.96,TCP,66,45230  >  443 [ACK] Seq=6871 Ack=49941 Win=120192 Len=0 TSval=1495228165 TSecr=4109514095,64,0x2,0x00,52
143,7.232164124,159.124.21.96,192.168.1.93,TLSv1.3,2962,Continuation Data,45,0x2,0x00,2948
144,7.232187929,192.168.1.93,159.124.21.96,TCP,66,45230  >  443 [ACK] Seq=6871 Ack=52837 Win=125952 Len=0 TSval=1495228169 TSecr=4109514101,64,0x2,0x00,52
145,7.238770095,159.124.21.96,192.168.1.93,TLSv1.3,2962,Continuation Data,45,0x2,0x00,2948
146,7.238849148,192.168.1.93,159.124.21.96,TCP,66,45230  >  443 [ACK] Seq=6871 Ack=55733 Win=131712 Len=0 TSval=1495228176 TSecr=4109514107,64,0x2,0x00,52
147,7.252972661,159.124.21.96,192.168.1.93,TLSv1.3,2962,Continuation Data,45,0x2,0x00,2948
148,7.252972962,159.124.21.96,192.168.1.93,TLSv1.3,2962,Continuation Data,45,0x2,0x00,2948
149,7.253003035,192.168.1.93,159.124.21.96,TCP,66,45230  >  443 [ACK] Seq=6871 Ack=58629 Win=137472 Len=0 TSval=1495228190 TSecr=4109514113,64,0x2,0x00,52
150,7.253333923,192.168.1.93,159.124.21.96,TCP,66,45230  >  443 [ACK] Seq=6871 Ack=61525 Win=143360 Len=0 TSval=1495228190 TSecr=4109514119,64,0x2,0x00,52
151,7.259711711,159.124.21.96,192.168.1.93,TLSv1.3,2962,Continuation Data,45,0x2,0x00,2948
152,7.259737122,192.168.1.93,159.124.21.96,TCP,66,45230  >  443 [ACK] Seq=6871 Ack=64421 Win=149120 Len=0 TSval=1495228197 TSecr=4109514124,64,0x2,0x00,52
153,7.26007429,159.124.21.96,192.168.1.93,TLSv1.3,2962,Continuation Data,45,0x2,0x00,2948
154,7.26008366,192.168.1.93,159.124.21.96,TCP,66,45230  >  443 [ACK] Seq=6871 Ack=67317 Win=154880 Len=0 TSval=1495228197 TSecr=4109514130,64,0x2,0x00,52
155,7.263856944,159.124.21.96,192.168.1.93,TLSv1.3,2962,Continuation Data,45,0x2,0x00,2948
156,7.263880775,192.168.1.93,159.124.21.96,TCP,66,45230  >  443 [ACK] Seq=6871 Ack=70213 Win=160640 Len=0 TSval=1495228201 TSecr=4109514133,64,0x2,0x00,52
157,7.265760227,159.124.21.96,192.168.1.93,TLSv1.3,2962,Continuation Data,45,0x2,0x00,2948
158,7.265779114,192.168.1.93,159.124.21.96,TCP,66,45230  >  443 [ACK] Seq=6871 Ack=73109 Win=166528 Len=0 TSval=1495228203 TSecr=4109514136,64,0x2,0x00,52
159,7.269746866,159.124.21.96,192.168.1.93,TLSv1.3,2962,Continuation Data,45,0x2,0x00,2948
160,7.269767356,192.168.1.93,159.124.21.96,TCP,66,45230  >  443 [ACK] Seq=6871 Ack=76005 Win=172288 Len=0 TSval=1495228207 TSecr=4109514139,64,0x2,0x00,52
161,7.277617885,159.124.21.96,192.168.1.93,TLSv1.3,2962,Continuation Data,45,0x2,0x00,2948
162,7.277654091,192.168.1.93,159.124.21.96,TCP,66,45230  >  443 [ACK] Seq=6871 Ack=78901 Win=178048 Len=0 TSval=1495228215 TSecr=4109514142,64,0x2,0x00,52
163,7.288559331,159.124.21.96,192.168.1.93,TLSv1.3,2962,Continuation Data,45,0x2,0x00,2948
164,7.288559814,159.124.21.96,192.168.1.93,TLSv1.3,2962,Continuation Data,45,0x2,0x00,2948
165,7.288593984,192.168.1.93,159.124.21.96,TCP,66,45230  >  443 [ACK] Seq=6871 Ack=81797 Win=183808 Len=0 TSval=1495228226 TSecr=4109514155,64,0x2,0x00,52
166,7.29132339,192.168.1.93,159.124.21.96,TCP,66,45230  >  443 [ACK] Seq=6871 Ack=84693 Win=189696 Len=0 TSval=1495228228 TSecr=4109514156,64,0x2,0x00,52
167,7.292305254,159.124.21.96,192.168.1.93,TLSv1.3,2962,Continuation Data,45,0x2,0x00,2948
168,7.292331923,192.168.1.93,159.124.21.96,TCP,66,45230  >  443 [ACK] Seq=6871 Ack=87589 Win=195456 Len=0 TSval=1495228229 TSecr=4109514159,64,0x2,0x00,52
169,7.294041751,159.124.21.96,192.168.1.93,TLSv1.3,2962,Continuation Data,45,0x2,0x00,2948
170,7.294061781,192.168.1.93,159.124.21.96,TCP,66,45230  >  443 [ACK] Seq=6871 Ack=90485 Win=201216 Len=0 TSval=1495228231 TSecr=4109514162,64,0x2,0x00,52
171,7.296590557,159.124.21.96,192.168.1.93,TLSv1.3,2962,Continuation Data,45,0x2,0x00,2948
172,7.296610302,192.168.1.93,159.124.21.96,TCP,66,45230  >  443 [ACK] Seq=6871 Ack=93381 Win=206976 Len=0 TSval=1495228234 TSecr=4109514165,64,0x2,0x00,52
173,7.299606449,159.124.21.96,192.168.1.93,TLSv1.3,2962,Continuation Data,45,0x2,0x00,2948
174,7.299670987,192.168.1.93,159.124.21.96,TCP,66,45230  >  443 [ACK] Seq=6871 Ack=96277 Win=212864 Len=0 TSval=1495228237 TSecr=4109514168,64,0x2,0x00,52
175,7.303264803,159.124.21.96,192.168.1.93,TLSv1.3,2962,Continuation Data,45,0x2,0x00,2948
176,7.303382461,192.168.1.93,159.124.21.96,TCP,66,45230  >  443 [ACK] Seq=6871 Ack=99173 Win=218624 Len=0 TSval=1495228240 TSecr=4109514171,64,0x2,0x00,52
177,7.305930023,159.124.21.96,192.168.1.93,TLSv1.3,2962,Continuation Data,45,0x2,0x00,2948
178,7.306048785,192.168.1.93,159.124.21.96,TCP,66,45230  >  443 [ACK] Seq=6871 Ack=102069 Win=224384 Len=0 TSval=1495228243 TSecr=4109514174,64,0x2,0x00,52
179,7.307858469,159.124.21.96,192.168.1.93,TLSv1.3,2962,Continuation Data,45,0x2,0x00,2948
180,7.307881418,192.168.1.93,159.124.21.96,TCP,66,45230  >  443 [ACK] Seq=6871 Ack=104965 Win=230144 Len=0 TSval=1495228245 TSecr=4109514177,64,0x2,0x00,52
181,7.310580858,159.124.21.96,192.168.1.93,TLSv1.3,2962,Continuation Data,45,0x2,0x00,2948
182,7.310599751,192.168.1.93,159.124.21.96,TCP,66,45230  >  443 [ACK] Seq=6871 Ack=107861 Win=236032 Len=0 TSval=1495228248 TSecr=4109514180,64,0x2,0x00,52
183,7.313683641,159.124.21.96,192.168.1.93,TLSv1.3,2962,Continuation Data,45,0x2,0x00,2948
184,7.313741472,192.168.1.93,159.124.21.96,TCP,66,45230  >  443 [ACK] Seq=6871 Ack=110757 Win=241792 Len=0 TSval=1495228251 TSecr=4109514183,64,0x2,0x00,52
185,7.315805222,159.124.21.96,192.168.1.93,TLSv1.3,1514,Continuation Data,45,0x2,0x00,1500
186,7.315860657,192.168.1.93,159.124.21.96,TCP,66,45230  >  443 [ACK] Seq=6871 Ack=112205 Win=244736 Len=0 TSval=1495228253 TSecr=4109514186,64,0x2,0x00,52
187,7.317677954,159.124.21.96,192.168.1.93,TLSv1.3,2962,Continuation Data,45,0x2,0x00,2948
188,7.317735908,192.168.1.93,159.124.21.96,TCP,66,45230  >  443 [ACK] Seq=6871 Ack=115101 Win=250496 Len=0 TSval=1495228255 TSecr=4109514187,64,0x2,0x00,52
189,7.321733231,159.124.21.96,192.168.1.93,TLSv1.3,2962,Continuation Data,45,0x2,0x00,2948
190,7.321800622,192.168.1.93,159.124.21.96,TCP,66,45230  >  443 [ACK] Seq=6871 Ack=117997 Win=256256 Len=0 TSval=1495228259 TSecr=4109514190,64,0x2,0x00,52
191,7.324394167,159.124.21.96,192.168.1.93,TLSv1.3,2962,Continuation Data,45,0x2,0x00,2948
192,7.324451168,192.168.1.93,159.124.21.96,TCP,66,45230  >  443 [ACK] Seq=6871 Ack=120893 Win=262016 Len=0 TSval=1495228262 TSecr=4109514193,64,0x2,0x00,52
193,7.327714623,159.124.21.96,192.168.1.93,TLSv1.3,2962,Continuation Data,45,0x2,0x00,2948
194,7.327765546,192.168.1.93,159.124.21.96,TCP,66,45230  >  443 [ACK] Seq=6871 Ack=123789 Win=267904 Len=0 TSval=1495228265 TSecr=4109514196,64,0x2,0x00,52
195,7.329584829,159.124.21.96,192.168.1.93,TLSv1.3,125,Continuation Data,45,0x2,0x00,111
196,7.329600874,192.168.1.93,159.124.21.96,TCP,66,45230  >  443 [ACK] Seq=6871 Ack=123848 Win=267904 Len=0 TSval=1495228267 TSecr=4109514199,64,0x2,0x00,52
197,7.535361823,159.124.21.96,192.168.1.93,DTLSv1.2,103,Application Data,44,0x2,0x00,89
198,7.539635465,192.168.1.93,159.124.21.96,DTLSv1.2,103,Application Data,64,0x2,0x00,89
199,7.609874455,159.124.21.96,192.168.1.93,DTLSv1.2,111,Application Data,44,0x2,0x00,97
200,7.618726082,192.168.1.93,159.124.21.96,STUN,194,Binding Request user: 6F4AA7FD-78DF-FCC4-F05B-958B6A09AE9D:4541BB66-D689-8DE7-07EF-2C88144219B5,64,0x2,0x00,180
201,7.660299362,159.124.21.96,192.168.1.93,DTLSv1.2,103,Application Data,44,0x2,0x00,89
202,7.661853776,192.168.1.93,159.124.21.96,DTLSv1.2,103,Application Data,64,0x2,0x00,89
203,7.692193856,159.124.21.96,192.168.1.93,STUN,106,Binding Success Response XOR-MAPPED-ADDRESS: 5.29.51.201:8466,44,0x2,0x00,92
204,7.830271688,192.168.1.93,159.124.21.96,DTLSv1.2,99,Application Data,64,0x2,0x00,85
205,8.140943083,192.168.1.93,159.124.21.96,TLSv1.3,163,Application Data,64,0x2,0x00,149
206,8.14856158,192.168.1.93,159.124.21.96,TLSv1.3,181,Application Data,64,0x2,0x00,167
207,8.158130698,192.168.1.93,159.124.21.96,TLSv1.3,143,Application Data,64,0x2,0x00,129
208,8.158828761,192.168.1.93,159.124.21.96,TLSv1.3,233,Application Data,64,0x2,0x00,219
209,8.214239486,159.124.21.96,192.168.1.93,TCP,66,443  >  45230 [ACK] Seq=123848 Ack=6968 Win=64128 Len=0 TSval=4109515083 TSecr=1495229078,45,0x2,0x00,52
210,8.220240646,159.124.21.96,192.168.1.93,TCP,66,443  >  45230 [ACK] Seq=123848 Ack=7083 Win=64128 Len=0 TSval=4109515091 TSecr=1495229086,45,0x2,0x00,52
211,8.225835086,192.168.1.93,159.124.21.96,TLSv1.3,96,Application Data,64,0x2,0x00,82
212,8.228106297,192.168.1.93,159.124.21.96,TLSv1.3,2115,Application Data,64,0x2,0x00,2101
213,8.230267633,159.124.21.96,192.168.1.93,TCP,66,443  >  45230 [ACK] Seq=123848 Ack=7160 Win=64128 Len=0 TSval=4109515101 TSecr=1495229095,45,0x2,0x00,52
214,8.232328326,159.124.21.96,192.168.1.93,TCP,66,443  >  45230 [ACK] Seq=123848 Ack=7327 Win=64128 Len=0 TSval=4109515101 TSecr=1495229096,45,0x2,0x00,52
215,8.243286144,192.168.1.93,159.124.21.96,TLSv1.3,96,Application Data,64,0x2,0x00,82
216,8.243640704,192.168.1.93,159.124.21.96,TLSv1.3,1320,Application Data,64,0x2,0x00,1306
217,8.243897933,192.168.1.93,159.124.21.96,TLSv1.3,225,Application Data,64,0x2,0x00,211
218,8.244138167,192.168.1.93,159.124.21.96,TLSv1.3,225,Application Data,64,0x2,0x00,211
219,8.298345814,159.124.21.96,192.168.1.93,TCP,66,443  >  45230 [ACK] Seq=123848 Ack=7357 Win=64128 Len=0 TSval=4109515169 TSecr=1495229163,45,0x2,0x00,52
220,8.301092123,159.124.21.96,192.168.1.93,TCP,66,443  >  45230 [ACK] Seq=123848 Ack=8805 Win=64128 Len=0 TSval=4109515171 TSecr=1495229165,45,0x2,0x00,52
221,8.301092166,159.124.21.96,192.168.1.93,TCP,66,443  >  45230 [ACK] Seq=123848 Ack=9406 Win=63616 Len=0 TSval=4109515171 TSecr=1495229165,45,0x2,0x00,52
222,8.318721946,159.124.21.96,192.168.1.93,TCP,66,443  >  45230 [ACK] Seq=123848 Ack=9436 Win=64128 Len=0 TSval=4109515185 TSecr=1495229180,45,0x2,0x00,52
223,8.331026278,159.124.21.96,192.168.1.93,TCP,66,443  >  45230 [ACK] Seq=123848 Ack=10690 Win=64128 Len=0 TSval=4109515187 TSecr=1495229181,45,0x2,0x00,52
224,8.331026646,159.124.21.96,192.168.1.93,TCP,66,443  >  45230 [ACK] Seq=123848 Ack=10849 Win=64128 Len=0 TSval=4109515187 TSecr=1495229181,45,0x2,0x00,52
225,8.331026688,159.124.21.96,192.168.1.93,TCP,66,443  >  45230 [ACK] Seq=123848 Ack=11008 Win=64000 Len=0 TSval=4109515187 TSecr=1495229181,45,0x2,0x00,52
226,9.398347131,192.168.1.93,159.124.21.96,TLSv1.3,802,Application Data,64,0x2,0x00,788
227,9.400271884,192.168.1.93,159.124.21.96,TLSv1.3,189,Application Data,64,0x2,0x00,175
228,9.473316141,159.124.21.96,192.168.1.93,TCP,66,443  >  45230 [ACK] Seq=123848 Ack=11744 Win=64128 Len=0 TSval=4109516343 TSecr=1495230335,45,0x2,0x00,52
229,9.475746648,159.124.21.96,192.168.1.93,TCP,66,443  >  45230 [ACK] Seq=123848 Ack=11867 Win=64128 Len=0 TSval=4109516345 TSecr=1495230337,45,0x2,0x00,52
230,9.880903716,192.168.1.93,159.124.21.96,TLSv1.3,189,Application Data,64,0x2,0x00,175
231,9.963086983,159.124.21.96,192.168.1.93,TCP,66,443  >  45230 [ACK] Seq=123848 Ack=11990 Win=64128 Len=0 TSval=4109516825 TSecr=1495230818,45,0x2,0x00,52
232,10.53970272,159.124.21.96,192.168.1.93,DTLSv1.2,103,Application Data,44,0x2,0x00,89
233,10.54101399,192.168.1.93,159.124.21.96,DTLSv1.2,103,Application Data,64,0x2,0x00,89
234,10.61151794,159.124.21.96,192.168.1.93,DTLSv1.2,111,Application Data,44,0x2,0x00,97
235,10.65871341,159.124.21.96,192.168.1.93,DTLSv1.2,103,Application Data,44,0x2,0x00,89
236,10.69785963,192.168.1.93,159.124.21.96,DTLSv1.2,103,Application Data,64,0x2,0x00,89
237,10.87165909,192.168.1.93,159.124.21.96,DTLSv1.2,99,Application Data,64,0x2,0x00,85
238,11.73784741,159.124.21.96,192.168.1.93,TLSv1.3,106,Application Data,45,0x2,0x00,92
239,11.73790858,192.168.1.93,159.124.21.96,TCP,66,45230  >  443 [ACK] Seq=11990 Ack=123888 Win=267904 Len=0 TSval=1495232675 TSecr=4109518607,64,0x2,0x00,52
240,11.75533099,192.168.1.93,159.124.21.96,TLSv1.3,110,Application Data,64,0x2,0x00,96
241,11.83292625,159.124.21.96,192.168.1.93,TCP,66,443  >  45230 [ACK] Seq=123888 Ack=12034 Win=64128 Len=0 TSval=4109518699 TSecr=1495232692,45,0x2,0x00,52
242,12.0536077,192.168.1.93,159.124.21.96,STUN,194,Binding Request user: 4D4E1327-1ADF-8C9D-33B1-B59FB236C0B7:4541BB66-D689-8DE7-07EF-2C88144219B5,64,0x2,0x00,180
243,12.12216177,159.124.21.96,192.168.1.93,STUN,106,Binding Success Response XOR-MAPPED-ADDRESS: 5.29.51.201:8466,44,0x2,0x00,92
244,12.54901342,159.124.21.96,192.168.1.93,TLSv1.3,151,Application Data,45,0x2,0x00,137
245,12.59027091,192.168.1.93,159.124.21.96,TCP,66,45230  >  443 [ACK] Seq=12034 Ack=123973 Win=267904 Len=0 TSval=1495233527 TSecr=4109519418,64,0x2,0x00,52
246,13.53946641,159.124.21.96,192.168.1.93,DTLSv1.2,103,Application Data,44,0x2,0x00,89
247,13.53981976,192.168.1.93,159.124.21.96,DTLSv1.2,103,Application Data,64,0x2,0x00,89
248,13.60993494,159.124.21.96,192.168.1.93,DTLSv1.2,111,Application Data,44,0x2,0x00,97
249,13.66382635,159.124.21.96,192.168.1.93,DTLSv1.2,103,Application Data,44,0x2,0x00,89
250,13.66441795,192.168.1.93,159.124.21.96,DTLSv1.2,103,Application Data,64,0x2,0x00,89
251,13.81597986,192.168.1.93,159.124.21.96,DTLSv1.2,99,Application Data,64,0x2,0x00,85
252,14.05451183,192.168.1.93,159.124.21.96,STUN,194,Binding Request user: 6F4AA7FD-78DF-FCC4-F05B-958B6A09AE9D:4541BB66-D689-8DE7-07EF-2C88144219B5,64,0x2,0x00,180
253,14.12652379,159.124.21.96,192.168.1.93,STUN,106,Binding Success Response XOR-MAPPED-ADDRESS: 5.29.51.201:8466,44,0x2,0x00,92
254,14.93383502,192.168.1.93,159.124.21.96,TLSv1.3,192,Application Data,64,0x2,0x00,178
255,14.93917912,192.168.1.93,159.124.21.96,TLSv1.3,188,Application Data,64,0x2,0x00,174
256,15.02125819,159.124.21.96,192.168.1.93,TCP,66,443  >  45230 [ACK] Seq=123973 Ack=12160 Win=64128 Len=0 TSval=4109521880 TSecr=1495235871,45,0x2,0x00,52
257,15.02125848,159.124.21.96,192.168.1.93,TCP,66,443  >  45230 [ACK] Seq=123973 Ack=12282 Win=64128 Len=0 TSval=4109521881 TSecr=1495235876,45,0x2,0x00,52
258,16.46764308,192.168.1.93,159.124.21.96,STUN,194,Binding Request user: 4D4E1327-1ADF-8C9D-33B1-B59FB236C0B7:4541BB66-D689-8DE7-07EF-2C88144219B5,64,0x2,0x00,180
259,16.53632346,159.124.21.96,192.168.1.93,STUN,106,Binding Success Response XOR-MAPPED-ADDRESS: 5.29.51.201:8466,44,0x2,0x00,92
260,16.54062014,159.124.21.96,192.168.1.93,DTLSv1.2,103,Application Data,44,0x2,0x00,89
261,16.5417973,192.168.1.93,159.124.21.96,DTLSv1.2,103,Application Data,64,0x2,0x00,89
262,16.61106005,159.124.21.96,192.168.1.93,DTLSv1.2,111,Application Data,44,0x2,0x00,97
263,16.6764075,159.124.21.96,192.168.1.93,DTLSv1.2,103,Application Data,44,0x2,0x00,89
264,16.68290799,192.168.1.93,159.124.21.96,DTLSv1.2,103,Application Data,64,0x2,0x00,89
265,16.86379931,192.168.1.93,159.124.21.96,DTLSv1.2,99,Application Data,64,0x2,0x00,85
266,17.73340216,159.124.21.96,192.168.1.93,TLSv1.3,106,Application Data,45,0x2,0x00,92
267,17.73356642,192.168.1.93,159.124.21.96,TCP,66,45230  >  443 [ACK] Seq=12282 Ack=124013 Win=267904 Len=0 TSval=1495238671 TSecr=4109524604,64,0x2,0x00,52
268,17.73375008,192.168.1.93,159.124.21.96,TLSv1.3,110,Application Data,64,0x2,0x00,96
269,17.80857792,159.124.21.96,192.168.1.93,TCP,66,443  >  45230 [ACK] Seq=124013 Ack=12326 Win=64128 Len=0 TSval=4109524677 TSecr=1495238671,45,0x2,0x00,52
270,18.92158278,192.168.1.93,159.124.21.96,STUN,194,Binding Request user: 6F4AA7FD-78DF-FCC4-F05B-958B6A09AE9D:4541BB66-D689-8DE7-07EF-2C88144219B5,64,0x2,0x00,180
271,19.0033486,159.124.21.96,192.168.1.93,STUN,106,Binding Success Response XOR-MAPPED-ADDRESS: 5.29.51.201:8466,44,0x2,0x00,92
272,19.54367106,159.124.21.96,192.168.1.93,DTLSv1.2,103,Application Data,44,0x2,0x00,89
273,19.54498891,192.168.1.93,159.124.21.96,DTLSv1.2,103,Application Data,64,0x2,0x00,89
274,19.61361034,159.124.21.96,192.168.1.93,DTLSv1.2,111,Application Data,44,0x2,0x00,97
275,19.65150748,159.124.21.96,192.168.1.93,TLSv1.3,186,Application Data,45,0x2,0x00,172
276,19.66772945,159.124.21.96,192.168.1.93,DTLSv1.2,103,Application Data,44,0x2,0x00,89
277,19.66955463,192.168.1.93,159.124.21.96,DTLSv1.2,103,Application Data,64,0x2,0x00,89
278,19.69901349,192.168.1.93,159.124.21.96,TCP,66,45230  >  443 [ACK] Seq=12326 Ack=124133 Win=267904 Len=0 TSval=1495240636 TSecr=4109526521,64,0x2,0x00,52
279,19.83057562,192.168.1.93,159.124.21.96,DTLSv1.2,99,Application Data,64,0x2,0x00,85
280,20.22335546,192.168.1.93,159.124.21.96,TLSv1.3,937,Application Data,64,0x2,0x00,923
281,20.30018426,159.124.21.96,192.168.1.93,TCP,66,443  >  45230 [ACK] Seq=124133 Ack=13197 Win=64128 Len=0 TSval=4109527170 TSecr=1495241160,45,0x2,0x00,52
282,20.99508708,192.168.1.93,159.124.21.96,STUN,194,Binding Request user: 4D4E1327-1ADF-8C9D-33B1-B59FB236C0B7:4541BB66-D689-8DE7-07EF-2C88144219B5,64,0x2,0x00,180
283,21.06480555,159.124.21.96,192.168.1.93,STUN,106,Binding Success Response XOR-MAPPED-ADDRESS: 5.29.51.201:8466,44,0x2,0x00,92
284,21.65650362,159.124.21.96,192.168.1.93,TLSv1.3,125,Application Data,45,0x2,0x00,111
285,21.65653053,192.168.1.93,159.124.21.96,TCP,66,45230  >  443 [ACK] Seq=13197 Ack=124192 Win=267904 Len=0 TSval=1495242594 TSecr=4109528524,64,0x2,0x00,52
286,22.10546477,192.168.1.93,159.124.21.96,TCP,74,45806  >  443 [SYN] Seq=0 Win=64240 Len=0 MSS=1460 SACK_PERM TSval=1495243043 TSecr=0 WS=128,64,0x2,0x00,60
287,22.18290567,159.124.21.96,192.168.1.93,TCP,74,"443  >  45806 [SYN, ACK] Seq=0 Ack=1 Win=65160 Len=0 MSS=1460 SACK_PERM TSval=4109529049 TSecr=1495243043 WS=128",45,0x2,0x00,60
288,22.1829356,192.168.1.93,159.124.21.96,TCP,66,45806  >  443 [ACK] Seq=1 Ack=1 Win=64256 Len=0 TSval=1495243120 TSecr=4109529049,64,0x2,0x00,52
289,22.18505051,192.168.1.93,159.124.21.96,TLSv1.3,583,Client Hello (SNI=zoomams1591242196rwg.ams.zoom.us),64,0x2,0x00,569
290,22.26270415,159.124.21.96,192.168.1.93,TCP,66,443  >  45806 [ACK] Seq=1 Ack=518 Win=64768 Len=0 TSval=4109529129 TSecr=1495243122,45,0x2,0x00,52
291,22.26464405,159.124.21.96,192.168.1.93,TLSv1.3,326,"Server Hello, Change Cipher Spec, Application Data, Application Data",45,0x2,0x00,312
292,22.26466352,192.168.1.93,159.124.21.96,TCP,66,45806  >  443 [ACK] Seq=518 Ack=261 Win=64128 Len=0 TSval=1495243202 TSecr=4109529131,64,0x2,0x00,52
293,22.26524093,192.168.1.93,159.124.21.96,TLSv1.3,146,"Change Cipher Spec, Application Data",64,0x2,0x00,132
294,22.26589485,192.168.1.93,159.124.21.96,TLSv1.3,2962,,64,0x2,0x00,2948
295,22.2661467,192.168.1.93,159.124.21.96,TLSv1.3,1172,Continuation Data,64,0x2,0x00,1158
296,22.3402051,159.124.21.96,192.168.1.93,TLSv1.3,145,Application Data,45,0x2,0x00,131
297,22.34520452,159.124.21.96,192.168.1.93,TCP,66,443  >  45806 [ACK] Seq=340 Ack=3494 Win=64128 Len=0 TSval=4109529211 TSecr=1495243203,45,0x2,0x00,52
298,22.38100855,192.168.1.93,159.124.21.96,TCP,66,45806  >  443 [ACK] Seq=4600 Ack=340 Win=64128 Len=0 TSval=1495243318 TSecr=4109529208,64,0x2,0x00,52
299,22.38620019,159.124.21.96,192.168.1.93,TCP,66,443  >  45806 [ACK] Seq=340 Ack=4600 Win=64128 Len=0 TSval=4109529254 TSecr=1495243203,45,0x2,0x00,52
300,22.39037124,159.124.21.96,192.168.1.93,TLSv1.3,533,Application Data,45,0x2,0x00,519
301,22.39039441,192.168.1.93,159.124.21.96,TCP,66,45806  >  443 [ACK] Seq=4600 Ack=807 Win=64128 Len=0 TSval=1495243328 TSecr=4109529258,64,0x2,0x00,52
302,22.39223205,159.124.21.96,192.168.1.93,TLSv1.3,236,Application Data,45,0x2,0x00,222
303,22.39225479,192.168.1.93,159.124.21.96,TCP,66,45806  >  443 [ACK] Seq=4600 Ack=977 Win=64128 Len=0 TSval=1495243329 TSecr=4109529258,64,0x2,0x00,52
304,22.39583419,192.168.1.93,159.124.21.96,TCP,74,45810  >  443 [SYN] Seq=0 Win=64240 Len=0 MSS=1460 SACK_PERM TSval=1495243333 TSecr=0 WS=128,64,0x2,0x00,60
305,22.46544746,159.124.21.96,192.168.1.93,TCP,74,"443  >  45810 [SYN, ACK] Seq=0 Ack=1 Win=65160 Len=0 MSS=1460 SACK_PERM TSval=4109529335 TSecr=1495243333 WS=128",43,0x2,0x00,60
306,22.46566606,192.168.1.93,159.124.21.96,TCP,66,45810  >  443 [ACK] Seq=1 Ack=1 Win=64256 Len=0 TSval=1495243403 TSecr=4109529335,64,0x2,0x00,52
307,22.46737136,192.168.1.93,159.124.21.96,TLSv1.3,583,Client Hello (SNI=zoomams1591242196rwg.ams.zoom.us),64,0x2,0x00,569
308,22.53642734,159.124.21.96,192.168.1.93,TCP,66,443  >  45810 [ACK] Seq=1 Ack=518 Win=64768 Len=0 TSval=4109529406 TSecr=1495243405,43,0x2,0x00,52
309,22.53642763,159.124.21.96,192.168.1.93,TLSv1.3,326,"Server Hello, Change Cipher Spec, Application Data, Application Data",43,0x2,0x00,312
310,22.53650854,192.168.1.93,159.124.21.96,TCP,66,45810  >  443 [ACK] Seq=518 Ack=261 Win=64128 Len=0 TSval=1495243474 TSecr=4109529408,64,0x2,0x00,52
311,22.53722229,192.168.1.93,159.124.21.96,TLSv1.3,146,"Change Cipher Spec, Application Data",64,0x2,0x00,132
312,22.53777566,192.168.1.93,159.124.21.96,TLSv1.3,2962,,64,0x2,0x00,2948
313,22.53785579,192.168.1.93,159.124.21.96,TLSv1.3,1172,Continuation Data,64,0x2,0x00,1158
314,22.54431723,159.124.21.96,192.168.1.93,DTLSv1.2,103,Application Data,44,0x2,0x00,89
315,22.54551877,192.168.1.93,159.124.21.96,DTLSv1.2,103,Application Data,64,0x2,0x00,89
316,22.60479182,159.124.21.96,192.168.1.93,TCP,66,443  >  45810 [ACK] Seq=261 Ack=2046 Win=64128 Len=0 TSval=4109529476 TSecr=1495243474,43,0x2,0x00,52
317,22.60479212,159.124.21.96,192.168.1.93,TLSv1.3,145,Application Data,43,0x2,0x00,131
318,22.60874107,159.124.21.96,192.168.1.93,TCP,66,443  >  45810 [ACK] Seq=340 Ack=4600 Win=64128 Len=0 TSval=4109529479 TSecr=1495243475,43,0x2,0x00,52
319,22.6148719,159.124.21.96,192.168.1.93,DTLSv1.2,111,Application Data,44,0x2,0x00,97
320,22.64394795,159.124.21.96,192.168.1.93,DTLSv1.2,1131,Application Data,44,0x2,0x00,1117
321,22.64519453,192.168.1.93,159.124.21.96,DTLSv1.2,99,Application Data,64,0x2,0x00,85
322,22.64565749,192.168.1.93,159.124.21.96,TCP,66,45810  >  443 [ACK] Seq=4600 Ack=340 Win=64128 Len=0 TSval=1495243583 TSecr=4109529477,64,0x2,0x00,52
323,22.65432781,159.124.21.96,192.168.1.93,DTLSv1.2,1131,Application Data,44,0x2,0x00,1117
324,22.65985266,159.124.21.96,192.168.1.93,TLSv1.3,533,Application Data,43,0x2,0x00,519
325,22.65985302,159.124.21.96,192.168.1.93,TLSv1.3,271,Application Data,43,0x2,0x00,257
326,22.6599402,192.168.1.93,159.124.21.96,TCP,66,45810  >  443 [ACK] Seq=4600 Ack=807 Win=64128 Len=0 TSval=1495243597 TSecr=4109529530,64,0x2,0x00,52
327,22.66013405,192.168.1.93,159.124.21.96,TCP,66,45810  >  443 [ACK] Seq=4600 Ack=1012 Win=64128 Len=0 TSval=1495243597 TSecr=4109529530,64,0x2,0x00,52
328,22.66913024,159.124.21.96,192.168.1.93,DTLSv1.2,103,Application Data,44,0x2,0x00,89
329,22.67007427,192.168.1.93,159.124.21.96,DTLSv1.2,103,Application Data,64,0x2,0x00,89
330,22.67322302,192.168.1.93,159.124.21.96,TCP,74,45820  >  443 [SYN] Seq=0 Win=64240 Len=0 MSS=1460 SACK_PERM TSval=1495243610 TSecr=0 WS=128,64,0x2,0x00,60
331,22.67384972,159.124.21.96,192.168.1.93,DTLSv1.2,1131,Application Data,44,0x2,0x00,1117
332,22.67481622,192.168.1.93,159.124.21.96,DTLSv1.2,99,Application Data,64,0x2,0x00,85
333,22.6858359,159.124.21.96,192.168.1.93,DTLSv1.2,1131,Application Data,44,0x2,0x00,1117
334,22.69642302,159.124.21.96,192.168.1.93,DTLSv1.2,1131,Application Data,44,0x2,0x00,1117
335,22.69681249,192.168.1.93,159.124.21.96,DTLSv1.2,99,Application Data,64,0x2,0x00,85
336,22.71585796,159.124.21.96,192.168.1.93,DTLSv1.2,1131,Application Data,44,0x2,0x00,1117
337,22.7320616,159.124.21.96,192.168.1.93,DTLSv1.2,1131,Application Data,44,0x2,0x00,1117
338,22.7336811,192.168.1.93,159.124.21.96,DTLSv1.2,99,Application Data,64,0x2,0x00,85
339,22.74588286,159.124.21.96,192.168.1.93,TCP,74,"443  >  45820 [SYN, ACK] Seq=0 Ack=1 Win=65160 Len=0 MSS=1460 SACK_PERM TSval=4109529612 TSecr=1495243610 WS=128",43,0x2,0x00,60
340,22.74602617,192.168.1.93,159.124.21.96,TCP,66,45820  >  443 [ACK] Seq=1 Ack=1 Win=64256 Len=0 TSval=1495243683 TSecr=4109529612,64,0x2,0x00,52
